"type","id","author","editor","advisor","note","title","pages","article_no","num_pages","keywords","doi","journal","issue_date","volume","issue_no","description","month","year","issn","booktitle","acronym","edition","isbn","conf_loc","publisher","publisher_loc"
"article","2933567","Chetanya  Puri and Arijit  Ukil and Soma  Bandyopadhyay and Rituraj  Singh and Arpan  Pal and Kayapanda  Mandana","","","","iCarMa: Inexpensive Cardiac Arrhythmia Management -- An IoT Healthcare Analytics Solution","3--8","","6","anomaly detection, cardio-vascular system, heart monitoring, iot, m-health, ppg, statistical learning","10.1145/2933566.2933567","","","","","","","2016","","Proceedings of the First Workshop on IoT-enabled Healthcare and Wellness Technologies and Systems","IoT of Health '16","","978-1-4503-4334-3","Singapore, Singapore","ACM","New York, NY, USA"
"article","3055087","Seyed Ali Rokni and Hassan  Ghasemzadeh","","","","Synchronous Dynamic View Learning: A Framework for Autonomous Training of Activity Recognition Models Using Wearable Sensors","79--90","","12","IoT, machine learning, signal processing, wearable sensors","10.1145/3055031.3055087","","","","","","","2017","","Proceedings of the 16th ACM/IEEE International Conference on Information Processing in Sensor Networks","IPSN '17","","978-1-4503-4890-4","Pittsburgh, Pennsylvania","ACM","New York, NY, USA"
"article","2248347","Avik  Ghose and Chirabrata  Bhaumik and Diptesh  Das and Amit Kumar Agrawal","","","","Mobile Healthcare Infrastructure for Home and Small Clinic","15--20","","6","intelligent healthcare, iot, mhealth, mobile application, sensor networks, sos, wireless healthcare monitoring","10.1145/2248341.2248347","","","","","","","2012","","Proceedings of the 2Nd ACM International Workshop on Pervasive Wireless Healthcare","MobileHealth '12","","978-1-4503-1292-9","Hilton Head, South Carolina, USA","ACM","New York, NY, USA"
"article","2905320","Vangipuram  Radhakrishna and P. V. Kumar and V.  Janaki","","","","Mining Outlier Temporal Association Patterns","105:1--105:6","105","6","Association Pattern, Temporal Similarity, Temporal support, outliers, temporal database","10.1145/2905055.2905320","","","","","","","2016","","Proceedings of the Second International Conference on Information and Communication Technology for Competitive Strategies","ICTCS '16","","978-1-4503-3962-9","Udaipur, India","ACM","New York, NY, USA"
"proceeding","3078861","","","","General Chair-Elisa  Bertino and Program Chair-Ravi  Sandhu and Program Chair-Edgar  Weippl","","","","","","","","","","","","","2017","","Proceedings of the 22Nd ACM on Symposium on Access Control Models and Technologies","","","978-1-4503-4702-0","Indianapolis, Indiana, USA","ACM","New York, NY, USA"
"article","3108936","M. Mazhar Rathore and Anand  Paul and Awais  Ahmad and Marco  Anisetti and Gwanggil  Jeon","","","","Hadoop-Based Intelligent Care System (HICS): Analytical Approach for Big Data in IoT","8:1--8:24","8","24","Big Data, IoT, PMD, healthcare, intelligent building","10.1145/3108936","ACM Trans. Internet Technol.","December 2017","18","1","","November","2017","1533-5399","","","","","","ACM","New York, NY, USA"
"article","2661713","Ben A. Amaba","","","","Industrial and Business Systems for Smart Cities","21--22","","2","Smart Cities, engineering","10.1145/2661704.2661713","","","","","","","2014","","Proceedings of the 1st International Workshop on Emerging Multimedia Applications and Services for Smart Cities","EMASC '14","","978-1-4503-3126-5","Orlando, Florida, USA","ACM","New York, NY, USA"
"article","3140377","Swarup  Chandra and Vishal M. Karande and Latifur R. Khan","","","","Secure IoT Stream Data Management and Analytics with Intel SGX","37--37","","1","privacy, security, sgx, trusted computing","10.1145/3140368.3140377","","","","","","","2017","","Proceedings of the 2017 Workshop on Automated Decision Making for Active Cyber Defense","SafeConfig '17","","978-1-4503-5203-1","Dallas, Texas, USA","ACM","New York, NY, USA"
"article","2727096","Fco Javier Ord&#243;&#241;ez and Paula  Toledo and Araceli  Sanchis","","","","Sensor-based Bayesian Detection of Anomalous Living Patterns in a Home Setting","259--270","","12","Anomaly detection, Bayesian statistics, Behavior patterns, Wireless sensor networks","10.1007/s00779-014-0820-1","Personal Ubiquitous Comput.","February  2015","19","2","","February","2015","1617-4909","","","","","","Springer-Verlag","London, UK, UK"
"proceeding","2902961","","","","General Chair-Ayse K. Coskun and General Chair-Martin  Margala and Program Chair-Laleh  Behjat and Program Chair-Jie  Han","","","","","","","","","","","","","2016","","Proceedings of the 26th Edition on Great Lakes Symposium on VLSI","","","978-1-4503-4274-2","Boston, Massachusetts, USA","ACM","New York, NY, USA"
