Item Title,Publication Title,Book Series Title,Journal Volume,Journal Issue,Item DOI,Authors,Publication Year,URL,Content Type
"Erratum to: XIV Mediterranean Conference on Medical and Biological Engineering and Computing 2016","XIV Mediterranean Conference on Medical and Biological Engineering and Computing 2016","","","","10.1007/978-3-319-32703-7_260","Efthyvoulos KyriacouStelios ChristofidesConstantinos S. Pattichis","2016","http://link.springer.com/chapter/10.1007/978-3-319-32703-7_260","Chapter"
"WSNs Applications","Wireless Sensor Networks","","","","10.1007/978-981-10-0412-4_3","Hossam Mahmoud Ahmad Fahmy","2016","http://link.springer.com/chapter/10.1007/978-981-10-0412-4_3","Chapter"
"Domestic Robotics","Springer Handbook of Robotics","","","","10.1007/978-3-319-32552-1_65","Erwin PrasslerMario E. MunichPaolo PirjanianKazuhiro Kosuge","2016","http://link.springer.com/chapter/10.1007/978-3-319-32552-1_65","Chapter"
"Skeuomorphic Reassurance: Personhood and Dementia","Technology and Intimacy: Choice or Coercion","","","","10.1007/978-3-319-44805-3_6","David KrepsOliver K. BurmeisterJessica Blaynee","2016","http://link.springer.com/chapter/10.1007/978-3-319-44805-3_6","Chapter"
"Home Networking: Smart but Complicated","Human-Computer Interaction. Applications and Services","","","","10.1007/978-3-319-07227-2_70","Abbas Moallem","2014","http://link.springer.com/chapter/10.1007/978-3-319-07227-2_70","Chapter"
"Lean Thinking in Dementia Care Through Smart Assistive Technology: An Evaluation","Lean Thinking for Healthcare","","","","10.1007/978-1-4614-8036-5_9","Trudy YuginovichJeffrey Soar","2014","http://link.springer.com/chapter/10.1007/978-1-4614-8036-5_9","Chapter"
"Balancing Act or Compromise? A Case Study Highlighting the Challenges of Trialling IT Services with the Elderly","Technology and Intimacy: Choice or Coercion","","","","10.1007/978-3-319-44805-3_5","Sue HesseyHazel LacoheeRob Collingridge","2016","http://link.springer.com/chapter/10.1007/978-3-319-44805-3_5","Chapter"
"Marginality and/or Centrality of the Open Spaces in the Strategies for Upgrading the Energy Efficiency of the City","Computational Science and Its Applications – ICCSA 2014","","","","10.1007/978-3-319-09150-1_24","Claudia PiscitelliFrancesco SelicatoDaniela Violante","2014","http://link.springer.com/chapter/10.1007/978-3-319-09150-1_24","Chapter"
"Towards a Taxonomy of Occupational Therapy Interventions: A Comparative Literature Analysis of Scientific Review Publications Published 2008–2013","International Handbook of Occupational Therapy Interventions","","","","10.1007/978-3-319-08141-0_3","Ingrid SöderbackKathryn L. Magill","2015","http://link.springer.com/chapter/10.1007/978-3-319-08141-0_3","Chapter"
"Context-Aware Based Quality of Life Telemonitoring","Distributed Systems and Applications of Information Filtering and Retrieval","","","","10.1007/978-3-642-40621-8_1","Eloisa VargiuJuan Manuel FernándezFelip Miralles","2014","http://link.springer.com/chapter/10.1007/978-3-642-40621-8_1","Chapter"
"Refusing to Go Away: The Ida Benderson Seniors Action Group","Occupying Disability: Critical Approaches to Community, Justice, and Decolonizing Disability","","","","10.1007/978-94-017-9984-3_12","Denise M. Nepveux","2016","http://link.springer.com/chapter/10.1007/978-94-017-9984-3_12","Chapter"
"A User-Centered Design Approach to Physical Motion Coaching Systems for Pervasive Health","Smart Health","","","","10.1007/978-3-319-16226-3_8","Norimichi UkitaDaniel KaulenCarsten Röcker","2015","http://link.springer.com/chapter/10.1007/978-3-319-16226-3_8","Chapter"
"Environment, Health and Ageing","Environmental Gerontology in Europe and Latin America","","","","10.1007/978-3-319-21419-1_5","George W. Leeson Ph.D.","2016","http://link.springer.com/chapter/10.1007/978-3-319-21419-1_5","Chapter"
"Character of Domain and Organization of Book","Consumer Health Informatics","","","","10.1007/978-3-319-19590-2_1","Thomas Wetter","2016","http://link.springer.com/chapter/10.1007/978-3-319-19590-2_1","Chapter"
"Mobile Health Applications: A Comparative Analysis and a Novel Mobile Health Platform","Sensor Systems and Software","","","","10.1007/978-3-319-17136-4_8","Antti VäänänenKeijo HaatajaMikko AsikainenIiro JantunenPekka Toivanen","2015","http://link.springer.com/chapter/10.1007/978-3-319-17136-4_8","Chapter"
"CoolMind: Collaborative, Ontology-Based Intelligent Knowledge Engineering for e-Society","On the Move to Meaningful Internet Systems: OTM 2015 Workshops","","","","10.1007/978-3-319-26138-6_48","Ioana CiuciuBazil Pârv","2015","http://link.springer.com/chapter/10.1007/978-3-319-26138-6_48","Chapter"
"Dementia Monitoring with Artificial Intelligence","Contemporary Consumer Health Informatics","","","","10.1007/978-3-319-25973-4_3","Andreas HamperIsabella Eigner","2016","http://link.springer.com/chapter/10.1007/978-3-319-25973-4_3","Chapter"
"Mobile@Old an ADL Solution","Business Information Systems Workshops","","","","10.1007/978-3-319-26762-3_16","Lucia RusuSergiu JecanDan Sitar","2015","http://link.springer.com/chapter/10.1007/978-3-319-26762-3_16","Chapter"
"Background","Smartphone-Based Human Activity Recognition","","","","10.1007/978-3-319-14274-6_2","Jorge Luis Reyes Ortiz","2015","http://link.springer.com/chapter/10.1007/978-3-319-14274-6_2","Chapter"
"BCI Applied to Neurorehabilitation","Emerging Therapies in Neurorehabilitation II","","","","10.1007/978-3-319-24901-8_7","I. N. Angulo-ShermanA. Costa-GarcíaE. Monge-PereiraR. Salazar-VarasR. Zerafa","2016","http://link.springer.com/chapter/10.1007/978-3-319-24901-8_7","Chapter"
"Research Methods Applied to Studies with Active Elderly: A Literature Review","Advances in Design for Inclusion","","","","10.1007/978-3-319-41962-6_38","Laura MartinsJoão BaptistaPedro Arezes","2016","http://link.springer.com/chapter/10.1007/978-3-319-41962-6_38","Chapter"
"Learning in the Context of an Ambient Assisted Living Apartment: Including Methods of Serious Gaming","Software Engineering Education for a Global E-Service Economy","","","","10.1007/978-3-319-04217-6_6","Sven LeonhardtStephan KasselAnne RandowTobias Teich","2014","http://link.springer.com/chapter/10.1007/978-3-319-04217-6_6","Chapter"
"Identification of Basic Behavioral Activities by Heterogeneous Sensors of In-Home Monitoring System","Human Behavior Understanding","","","","10.1007/978-3-319-24195-1_12","Vasily MoshnyagaTanaka OsamuToshin RyuKoji Hashimoto","2015","http://link.springer.com/chapter/10.1007/978-3-319-24195-1_12","Chapter"
"A Mechanism for Nominating Video Clips to Provide Assistance for Instrumental Activities of Daily Living","Ambient Assisted Living. ICT-based Solutions in Real Life Situations","","","","10.1007/978-3-319-26410-3_7","Joseph RaffertyChris NugentJun LiuLiming Chen","2015","http://link.springer.com/chapter/10.1007/978-3-319-26410-3_7","Chapter"
"Towards to a Usable and Accessible Mixed Global Standard DTT-IPTV","Applications and Usability of Interactive TV","","","","10.1007/978-3-319-38907-3_8","Carlos de CastroDiego VillamarínGonzalo OlmedoEnrique García","2016","http://link.springer.com/chapter/10.1007/978-3-319-38907-3_8","Chapter"
"‘Science to Action’ of the Sustainable Low Carbon City-region","Enabling Asia to Stabilise the Climate","","","","10.1007/978-981-287-826-7_7","Chin Siong HoLoon Wai ChauBor Tsong TehYuzuru MatsuokaKei Gomi","2016","http://link.springer.com/chapter/10.1007/978-981-287-826-7_7","Chapter"
"A Case Study in Healthcare Informatics: A Telemedicine Framework for Automated Parkinson’s Disease Symptom Assessment","Smart Health","","","","10.1007/978-3-319-08416-9_20","Taha KhanMevludin MemediWilliam SongJerker Westin","2014","http://link.springer.com/chapter/10.1007/978-3-319-08416-9_20","Chapter"
"An Approach to Automate Health Monitoring in Compliance with Personal Privacy","Smart Health","","","","10.1007/978-3-319-29175-8_3","Nikolay KazantsevDaniil KorolevDmitry TorshinAnna Mikhailova","2016","http://link.springer.com/chapter/10.1007/978-3-319-29175-8_3","Chapter"
"Augmenting Human Capabilities with AI","Social Machines","","","","10.1007/978-1-4842-1156-4_6","James HendlerAlice M. Mulvehill","2016","http://link.springer.com/chapter/10.1007/978-1-4842-1156-4_6","Chapter"
"Building Assets of Local Development","Creating Economic Growth","","","","10.1057/9781137427052_2","Marco Magnani","2014","http://link.springer.com/chapter/10.1057/9781137427052_2","Chapter"
"Automatic Prediction of Falls via Heart Rate Variability and Data Mining in Hypertensive Patients: The SHARE Project Experience","6th European Conference of the International Federation for Medical and Biological Engineering","","","","10.1007/978-3-319-11128-5_11","Paolo MelilloAlan JovicNicola De LucaStephen P. MorganLeandro Pecchia","2015","http://link.springer.com/chapter/10.1007/978-3-319-11128-5_11","Chapter"
"Configurable, Energy-Efficient, Application- and Channel-Aware Middleware Approaches for Cyber-Physical Systems","Computational Intelligence for Decision Support in Cyber-Physical Systems","","","","10.1007/978-981-4585-36-1_1","Khalid NawazIlia PetrovAlejandro P. Buchmann","2014","http://link.springer.com/chapter/10.1007/978-981-4585-36-1_1","Chapter"
"A Web Platform to Collect, Manage and Share Heterogeneous Sensor Data","Sensors","","","","10.1007/978-1-4614-3860-1_100","Andrea PirasDavide CarboniAntonio Pintus","2014","http://link.springer.com/chapter/10.1007/978-1-4614-3860-1_100","Chapter"
"Investigating Various Technologies Applied to Assist Seniors","Health Information Science","","","","10.1007/978-3-319-19156-0_21","Pouria KhosraviAmir Hossein GhapanchiMichael Blumenstein","2015","http://link.springer.com/chapter/10.1007/978-3-319-19156-0_21","Chapter"
"Applying Ontologies and Agent Technologies to Generate Ambient Intelligence Applications","Agent Technology for Intelligent Mobile Services and Smart Societies","","","","10.1007/978-3-662-46241-6_3","Artur FreitasDaniela SchmidtAlison PanissonRafael H. BordiniFelipe MeneguzziRenata Vieira","2015","http://link.springer.com/chapter/10.1007/978-3-662-46241-6_3","Chapter"
"Network Topologies, Communication Protocols, and Standards","Body Sensor Networks","","","","10.1007/978-1-4471-6374-9_5","Javier EspinaThomas FalckAthanasia PanousopoulouLars SchmittOliver MülhensGuang-Zhong Yang PhD","2014","http://link.springer.com/chapter/10.1007/978-1-4471-6374-9_5","Chapter"
"Analysis of Public Interest in Environmental Health Information: Fine Tuning Content for Dissemination via Social Media","Collective Online Platforms for Financial and Environmental Awareness","","","","10.1007/978-3-319-50237-3_6","Hai-Ying LiuIrene EletaMike KobernusTom Cole-Hunter","2016","http://link.springer.com/chapter/10.1007/978-3-319-50237-3_6","Chapter"
"Perspectives on Enabling Technologies for Intelligent Wireless Sensor Networks","Wireless World in 2050 and Beyond: A Window into the Future!","","","","10.1007/978-3-319-42141-4_6","Homayoun Nikookar","2016","http://link.springer.com/chapter/10.1007/978-3-319-42141-4_6","Chapter"
"Where Is the Forgotten Giant Heading to? The Current State and Future of Japanese Economics and Politics","Italy and Japan: How Similar Are They?","","","","10.1007/978-88-470-2568-4_4","Vittorio Volpi","2014","http://link.springer.com/chapter/10.1007/978-88-470-2568-4_4","Chapter"
"Quantitative and Qualitative Rating and Ranking Studies for Consolidation of an Application Portfolio for Large Scale Pilots","Ambient Assisted Living","","","","10.1007/978-3-319-11866-6_14","Henk Herman NapAd van BerloReiner Wichert","2015","http://link.springer.com/chapter/10.1007/978-3-319-11866-6_14","Chapter"
"Socio-Economics Aspects of Housing Quality in the Context of Energy Poverty","Smart City 360°","","","","10.1007/978-3-319-33681-7_53","Daniela SpirkovaMaria ZubkovaJanka BabelovaDagmar Caganova","2016","http://link.springer.com/chapter/10.1007/978-3-319-33681-7_53","Chapter"
"The ENRICHME Project: Lessons Learnt from a First Interaction with the Elderly","Social Robotics","","","","10.1007/978-3-319-47437-3_72","Roxana AgrigoroaieFrançois FerlandAdriana Tapus","2016","http://link.springer.com/chapter/10.1007/978-3-319-47437-3_72","Chapter"
"The Rise of China and India—Its Implications","The Global Rise of Asian Transformation","","","","10.1057/9781137412362_6","Pongsak HoontrakulChristopher BaldingReena Marwah","2014","http://link.springer.com/chapter/10.1057/9781137412362_6","Chapter"
"EHealth Applications for Those in Need: Making Novel Interaction Technologies Accessible","Pervasive Health","","","","10.1007/978-1-4471-6413-5_3","Martin BöckerMatthias Schneider","2014","http://link.springer.com/chapter/10.1007/978-1-4471-6413-5_3","Chapter"
"21st Century Men and the Digital Amalgamation of Life","Lifelogging","","","","10.1007/978-3-658-13137-1_5","Peter BiniokInes Hülsmann","2016","http://link.springer.com/chapter/10.1007/978-3-658-13137-1_5","Chapter"
"Designing a Multi-sided Health and Wellbeing Platform: Results of a First Design Cycle","Smart Homes and Health Telematics","","","","10.1007/978-3-319-14424-5_1","W. J. W. Keijzer-BroersG. A. de ReuverN. A. Guldemond","2015","http://link.springer.com/chapter/10.1007/978-3-319-14424-5_1","Chapter"
"An Adaptive Home Environment Supporting People with Balance Disorders","XIII Mediterranean Conference on Medical and Biological Engineering and Computing 2013","","","","10.1007/978-3-319-00846-2_300","Iliana BakolaChristos BellosEvanthia E. TripolitiAthanasios BibasDimitrios KoutsourisDimitrios I. Fotiadis","2014","http://link.springer.com/chapter/10.1007/978-3-319-00846-2_300","Chapter"
"Conclusions","Smart Homes","","","","10.1007/978-3-319-13557-1_7","Nagender Kumar SuryadevaraSubhas Chandra Mukhopadhyay","2015","http://link.springer.com/chapter/10.1007/978-3-319-13557-1_7","Chapter"
"The mATHENA Inventory for Free Mobile Assistive Technology Applications","On the Move to Meaningful Internet Systems: OTM 2015 Workshops","","","","10.1007/978-3-319-26138-6_56","Georgios KouroupetroglouSpyridon KousidisParaskevi RigaAlexandros Pino","2015","http://link.springer.com/chapter/10.1007/978-3-319-26138-6_56","Chapter"
"AAL Technologies for Independent Life of Elderly People","Ambient Assisted Living","","","","10.1007/978-3-319-18374-9_31","Flavia BenetazzoFrancesco FerracutiAlessandro FreddiAndrea GiantomassiSabrina IarloriSauro LonghiAndrea MonteriùDavide Ortenzi","2015","http://link.springer.com/chapter/10.1007/978-3-319-18374-9_31","Chapter"
"Development of Human-Centered Social Robot with Embedded Personality for Elderly Care","New Trends in Medical and Service Robots","","","","10.1007/978-3-319-30674-2_18","Aleksandar RodićMilica VujovićIlija StevanovićMiloš Jovanović","2016","http://link.springer.com/chapter/10.1007/978-3-319-30674-2_18","Chapter"
"Anomaly Detection in Elderly Daily Behavior in Ambient Sensing Environments","Human Behavior Understanding","","","","10.1007/978-3-319-46843-3_4","Oya AranDairazalia Sanchez-CortesMinh-Tri DoDaniel Gatica-Perez","2016","http://link.springer.com/chapter/10.1007/978-3-319-46843-3_4","Chapter"
"A Case Study on the Analysis of Behavior Patterns and Pattern Changes in Smart Environments","Ambient Assisted Living and Daily Activities","","","","10.1007/978-3-319-13105-4_43","Paula LagoClaudia Jiménez-GuarínClaudia Roncancio","2014","http://link.springer.com/chapter/10.1007/978-3-319-13105-4_43","Chapter"
"Electronic Health Records and Patient Activation – Their Interactive Role in Medication Adherence","Smart Health","","","","10.1007/978-3-319-29175-8_21","Yunfeng ShiVeronica Fuentes-CaceresMegan McHughJessica GreeneNina VerevkinaLawrence CasalinoStephen Shortell","2016","http://link.springer.com/chapter/10.1007/978-3-319-29175-8_21","Chapter"
"Inclusivity in the Digital Connected Home","HCI International 2014 - Posters’ Extended Abstracts","","","","10.1007/978-3-319-07854-0_42","Tim PennickSue HesseyYingyan Gu","2014","http://link.springer.com/chapter/10.1007/978-3-319-07854-0_42","Chapter"
"Ontology and Rules-Based Model to Reason on Useful Contextual Information for Providing Appropriate Services in U-Healthcare Systems","Intelligent Distributed Computing VIII","","","","10.1007/978-3-319-10422-5_32","Amina HameurLaineKenza AbdelazizPhilippe RooseMohamed-Khireddine Kholladi","2015","http://link.springer.com/chapter/10.1007/978-3-319-10422-5_32","Chapter"
"Affordable Smart Living System Prototype Based on Generic Environmental Sensors","ICT Innovations 2015","","","","10.1007/978-3-319-25733-4_12","Zarko PopovskiVladimir Trajkovik","2016","http://link.springer.com/chapter/10.1007/978-3-319-25733-4_12","Chapter"
"Nursing Informatics","Introduction to Nursing Informatics","","","","10.1007/978-1-4471-2999-8_2","Margaret Ann Kennedy RN, PhD, CPHIMS-CAPamela Hussey RN, RCN, MEd, MSc, PhD","2015","http://link.springer.com/chapter/10.1007/978-1-4471-2999-8_2","Chapter"
"Combining Multiple Sensors for Event Detection of Older People","Health Monitoring and Personalized Feedback using Multimedia Data","","","","10.1007/978-3-319-17963-6_10","Carlos F. Crispim-JuniorQiao MaBaptiste FostyRim RomdhaneFrancois BremondMonique Thonnat","2015","http://link.springer.com/chapter/10.1007/978-3-319-17963-6_10","Chapter"
"What if Your Floor Could Tell Someone You Fell? A Device Free Fall Detection Method","Artificial Intelligence in Medicine","","","","10.1007/978-3-319-19551-3_10","Roberto Luis Shinmoto TorresAsanga WickramasingheViet Ninh PhamDamith Chinthana Ranasinghe","2015","http://link.springer.com/chapter/10.1007/978-3-319-19551-3_10","Chapter"
"Multi-resident Activity Recognition Using Incremental Decision Trees","Adaptive and Intelligent Systems","","","","10.1007/978-3-319-11298-5_19","Markus ProsseggerAbdelhamid Bouchachia","2014","http://link.springer.com/chapter/10.1007/978-3-319-11298-5_19","Chapter"
"The Challenges behind Independent Living Support Systems","Active Media Technology","","","","10.1007/978-3-319-09912-5_39","Giampaolo BellaPekka JäppinenJussi Laakkonen","2014","http://link.springer.com/chapter/10.1007/978-3-319-09912-5_39","Chapter"
"The Limits of Humans","Social Machines","","","","10.1007/978-1-4842-1156-4_4","James HendlerAlice M. Mulvehill","2016","http://link.springer.com/chapter/10.1007/978-1-4842-1156-4_4","Chapter"
"Conclusion","Distributed Computing and Monitoring Technologies for Older Patients","","","","10.1007/978-3-319-27024-1_7","Juris KlonovsMohammad A. HaqueVolker KruegerKamal NasrollahiKaren Andersen-RanbergThomas B. MoeslundErika G. Spaich","2016","http://link.springer.com/chapter/10.1007/978-3-319-27024-1_7","Chapter"
"Ambient and Aesthetic Intelligence for High-End Hospitality","HCI in Business","","","","10.1007/978-3-319-20895-4_69","Daniela Alina PleweRui An OngCarsten Röcker","2015","http://link.springer.com/chapter/10.1007/978-3-319-20895-4_69","Chapter"
"Regression Analysis for Gesture Recognition Using RFID Technology","Smart Homes and Health Telematics","","","","10.1007/978-3-319-14424-5_13","Kevin BouchardBruno BouchardAbdenour Bouzouane","2015","http://link.springer.com/chapter/10.1007/978-3-319-14424-5_13","Chapter"
"Valorization of Assistive Technologies for Cognition: Lessons and Practices","Trends in Ambient Intelligent Systems","","","","10.1007/978-3-319-30184-6_3","Stéphanie PinardKevin BouchardYannick AdeliseVéronique FortinHélène PigotNathalie BierSylvain Giroux","2016","http://link.springer.com/chapter/10.1007/978-3-319-30184-6_3","Chapter"
"Monitoring Technology","Distributed Computing and Monitoring Technologies for Older Patients","","","","10.1007/978-3-319-27024-1_4","Juris KlonovsMohammad A. HaqueVolker KruegerKamal NasrollahiKaren Andersen-RanbergThomas B. MoeslundErika G. Spaich","2016","http://link.springer.com/chapter/10.1007/978-3-319-27024-1_4","Chapter"
"Testing Real-Time In-Home Fall Alerts with Embedded Depth Video Hyperlink","Smart Homes and Health Telematics","","","","10.1007/978-3-319-14424-5_5","Erik E. StoneMarjorie Skubic","2015","http://link.springer.com/chapter/10.1007/978-3-319-14424-5_5","Chapter"
"Annex: Executive Summary and Health Deal","AiREAS: Sustainocracy for a Healthy City","","","","10.1007/978-3-319-45620-1_8","Jean-Paul CloseEric de Groot","2016","http://link.springer.com/chapter/10.1007/978-3-319-45620-1_8","Chapter"
"The 2nd Convergence: A Technology Viewpoint","Media Convergence Handbook - Vol. 1","","","","10.1007/978-3-642-54484-2_3","Marie-José Montpetit Ph.D.","2016","http://link.springer.com/chapter/10.1007/978-3-642-54484-2_3","Chapter"
"Agent-Based Simulation for Identifying the Key Advantages of Intelligent Environments for Inhabitants with Special Needs","Advanced Computer and Communication Engineering Technology","","","","10.1007/978-3-319-24584-3_87","Karel MlsRichard CimlerPeter Mikulecky","2016","http://link.springer.com/chapter/10.1007/978-3-319-24584-3_87","Chapter"
"Sustainable Energy and Transport Systems","Conscious Coastal Cities","","","","10.1007/978-3-319-20218-1_4","Voula P. Mega","2016","http://link.springer.com/chapter/10.1007/978-3-319-20218-1_4","Chapter"
"Spatial Planning and Design Citizenship","Human Smart Cities","","","","10.1007/978-3-319-33024-2_6","Guy Julier","2016","http://link.springer.com/chapter/10.1007/978-3-319-33024-2_6","Chapter"
"Automatic Detection of Health Emergency States at Home","XIII Mediterranean Conference on Medical and Biological Engineering and Computing 2013","","","","10.1007/978-3-319-00846-2_299","M. VelaD. Ruiz-Fernández","2014","http://link.springer.com/chapter/10.1007/978-3-319-00846-2_299","Chapter"
"eServices - Service Platform for Pervasive Elderly Care","Ambient Intelligence - Software and Applications","","","","10.1007/978-3-319-19695-4_21","Isabel MarcelinoRosalía LazaPatrício DominguesSilvana Gómez-MeireAntónio Pereira","2015","http://link.springer.com/chapter/10.1007/978-3-319-19695-4_21","Chapter"
"Personalized Hand Pose and Gesture Recognition System for the Elderly","Universal Access in Human-Computer Interaction. Aging and Assistive Environments","","","","10.1007/978-3-319-07446-7_19","Mahsa TeimourikiaHassan SaidinejadSara ComaiFabio Salice","2014","http://link.springer.com/chapter/10.1007/978-3-319-07446-7_19","Chapter"
"Body Area Sensing Networks for Remote Health Monitoring","Modern Stroke Rehabilitation through e-Health-based Entertainment","","","","10.1007/978-3-319-21293-7_4","Dwaipayan BiswasAndy CrannyKoushik Maharatna","2016","http://link.springer.com/chapter/10.1007/978-3-319-21293-7_4","Chapter"
"Aveiro: Civic Movements to Promote Smarter Decisions for the Future of the City","Human Smart Cities","","","","10.1007/978-3-319-33024-2_14","José Carlos Mota Ph.D.Gonçalo Santinha Ph.D.","2016","http://link.springer.com/chapter/10.1007/978-3-319-33024-2_14","Chapter"
"Functional Assessment in Elderlies’ Homes: Early Results from a Field Trial","Ambient Assisted Living","","","","10.1007/978-3-642-37988-8_1","Enno-E. SteenThomas FrenkenMelina FrenkenAndreas Hein","2014","http://link.springer.com/chapter/10.1007/978-3-642-37988-8_1","Chapter"
"Food, Environment and Quality of Life","Food Culture, Consumption and Society","","","","10.1057/9781137398178_5","Paolo Corvo","2015","http://link.springer.com/chapter/10.1057/9781137398178_5","Chapter"
"Design of a Mobile Application to Support Non-pharmacological Therapies for People with Alzheimer Disease","Smart Health","","","","10.1007/978-3-319-29175-8_30","Angie K. ReyesJorge E. CamargoGloria M. Díaz","2016","http://link.springer.com/chapter/10.1007/978-3-319-29175-8_30","Chapter"
"Recognizing Daily Activities in Realistic Environments Through Depth-Based User Tracking and Hidden Conditional Random Fields for MCI/AD Support","Computer Vision - ECCV 2014 Workshops","","","","10.1007/978-3-319-16199-0_57","Dimitris GiakoumisGeorgios StavropoulosDimitrios KikidisManolis VasileiadisKonstantinos VotisDimitrios Tzovaras","2015","http://link.springer.com/chapter/10.1007/978-3-319-16199-0_57","Chapter"
"Analyzing Sounds of Home Environment for Device Recognition","Ambient Intelligence","","","","10.1007/978-3-319-14112-1_1","Svilen DimitrovJochen BritzBoris BrandhermJochen Frey","2014","http://link.springer.com/chapter/10.1007/978-3-319-14112-1_1","Chapter"
"Interoperability and mHealth – Precondition for Successful eCare","Mobile Health","","","","10.1007/978-3-319-12817-7_16","Mate BeštekAndrej Brodnik","2015","http://link.springer.com/chapter/10.1007/978-3-319-12817-7_16","Chapter"
"Actimetry@home: Actimetric Tele-surveillance and Tailored to the Signal Data Compression","Smart Homes and Health Telematics","","","","10.1007/978-3-319-14424-5_7","Jacques DemongeotOlivier HansenAli HamieHana HazguiGilles VironeNicolas Vuillerme","2015","http://link.springer.com/chapter/10.1007/978-3-319-14424-5_7","Chapter"
"Do We Need an Integrated Framework for Ambient Assisted Living?","Ubiquitous Computing and Ambient Intelligence","","","","10.1007/978-3-319-48799-1_7","Ashalatha KunnappillyCristina SeceleanuMaria Lindén","2016","http://link.springer.com/chapter/10.1007/978-3-319-48799-1_7","Chapter"
"Cloud Based Assistive Technologies and Smart Living Environment System","Mobile Networks and Management","","","","10.1007/978-3-319-16292-8_26","Vlatko NikolovskiPetre LameskiBoban JoksimoskiIvan Chorbev","2015","http://link.springer.com/chapter/10.1007/978-3-319-16292-8_26","Chapter"
"Eight Paths of Innovations in a Lean Startup Manner: A Case Study","Product-Focused Software Process Improvement","","","","10.1007/978-3-319-49094-6_2","Mikko RaatikainenMarko KomssiHarri KiljanderLaura HokkanenJukka MärijärviOmar Mohout","2016","http://link.springer.com/chapter/10.1007/978-3-319-49094-6_2","Chapter"
