Item Title,Publication Title,Book Series Title,Journal Volume,Journal Issue,Item DOI,Authors,Publication Year,URL,Content Type
"A Smart Home Model Using Android Application","Proceedings of the 7th International Conference on Kansei Engineering and Emotion Research 2018","","","","10.1007/978-981-10-8612-0_1","Kashif NisarAg Asri Ag Ibrahim","2018","http://link.springer.com/chapter/10.1007/978-981-10-8612-0_1","Chapter"
"Rising Ageing Population: A Preliminary Study of Malaysian Older People Expectations in Information and Communication Technology","Recent Trends in Information and Communication Technology","","","","10.1007/978-3-319-59427-9_82","Lili Marziana AbdullahMuna AzuddinSofianiza Abd MalikMurni Mahmud","2018","http://link.springer.com/chapter/10.1007/978-3-319-59427-9_82","Chapter"
"A Deep Learning-Based Gait Posture Recognition from Depth Information for Smart Home Applications","Advances in Computer Science and Ubiquitous Computing","","","","10.1007/978-981-10-3023-9_64","Md. Zia UddinMi Ryang Kim","2017","http://link.springer.com/chapter/10.1007/978-981-10-3023-9_64","Chapter"
"Perceived Benefits and Risks of Smart Home Technologies","Smart Homes and Their Users","","","","10.1007/978-3-319-68018-7_3","Tom HargreavesCharlie Wilson","2017","http://link.springer.com/chapter/10.1007/978-3-319-68018-7_3","Chapter"
"Activity Recognition Using Imagery for Smart Home Monitoring","Advances in Soft Computing and Machine Learning in Image Processing","","","","10.1007/978-3-319-63754-9_16","Bradley SchneiderTanvi Banerjee","2018","http://link.springer.com/chapter/10.1007/978-3-319-63754-9_16","Chapter"
"Analyzing mHeath Usage Using the mPower Data","Smart Health","","","","10.1007/978-3-319-67964-8_11","Jiexun LiXiaohui Chang","2017","http://link.springer.com/chapter/10.1007/978-3-319-67964-8_11","Chapter"
"The Role of Design as Technology Enabler: A Personalized Integrated Predictive Diabetes Management System","Wireless Mobile Communication and Healthcare","","","","10.1007/978-3-319-58877-3_49","Venere FerraroVenanzio Arquilla","2017","http://link.springer.com/chapter/10.1007/978-3-319-58877-3_49","Chapter"
"Problematic Milieus: Individuating Speculative Designs","New Directions in Third Wave Human-Computer Interaction: Volume 2 - Methodologies","","","","10.1007/978-3-319-73374-6_9","Tyler Fox","2018","http://link.springer.com/chapter/10.1007/978-3-319-73374-6_9","Chapter"
"Ambient Assisted Living and Digital Inclusion: Overview of Projects, Services and Interfaces","Universal Access in Human-Computer Interaction. Virtual, Augmented, and Intelligent Environments","","","","10.1007/978-3-319-92052-8_15","Alessandro AndreadisRiccardo Zambon","2018","http://link.springer.com/chapter/10.1007/978-3-319-92052-8_15","Chapter"
"Demographic Changes","Rising Powers and Global Governance","","","","10.1057/978-1-137-59815-8_10","Shahid Javed Burki","2017","http://link.springer.com/chapter/10.1057/978-1-137-59815-8_10","Chapter"
"Statistical Features for Objects Localization with Passive RFID in Smart Homes","Smart Objects and Technologies for Social Good","","","","10.1007/978-3-319-76111-4_3","Kevin Bouchard","2018","http://link.springer.com/chapter/10.1007/978-3-319-76111-4_3","Chapter"
"Innovative Healthcare Systems: An Introduction","Innovative Healthcare Systems for the 21st Century","","","","10.1007/978-3-319-55774-8_1","Hassan Qudrat-Ullah","2017","http://link.springer.com/chapter/10.1007/978-3-319-55774-8_1","Chapter"
"Community Care Alternatives for Older Adults","Chronic Illness Care","","","","10.1007/978-3-319-71812-5_21","Amy C. Denham","2018","http://link.springer.com/chapter/10.1007/978-3-319-71812-5_21","Chapter"
"A Deeper Insight on Developments and Real-Time Applications of Smart Dust Particle Sensor Technology","Computational Vision and Bio Inspired Computing","","","","10.1007/978-3-319-71767-8_16","Shreya SathyanSini Raj Pulari","2018","http://link.springer.com/chapter/10.1007/978-3-319-71767-8_16","Chapter"
"How Technologies Contribute to Urban Sustainability: The Case of Curitiba—Brazil","Lifelong Learning and Education in Healthy and Sustainable Cities","","","","10.1007/978-3-319-69474-0_29","Paola P. SaraivaLauro A. RibeiroInara P. CamaraThaísa L. da Silva","2018","http://link.springer.com/chapter/10.1007/978-3-319-69474-0_29","Chapter"
"Outlook for China’s Industrialization","China's Industrialization Process","","","","10.1007/978-981-10-3665-1_5","Qunhui Huang","2018","http://link.springer.com/chapter/10.1007/978-981-10-3665-1_5","Chapter"
"A Single Depth Silhouette-Based Hand Gesture Recognition for Appliance Interfaces in Smart Home Environment","6th International Conference on the Development of Biomedical Engineering in Vietnam (BME6)","","","","10.1007/978-981-10-4361-1_62","Dong-Luong DinhPham Thi Kim NgoanNguyen Duc ThangTae-Seong Kim","2018","http://link.springer.com/chapter/10.1007/978-981-10-4361-1_62","Chapter"
"Assistive Dementia Care System Through Smart Home","Proceedings of First International Conference on Smart System, Innovations and Computing","","","","10.1007/978-981-10-5828-8_43","K. S. GayathriSusan EliasK. S. Easwarakumar","2018","http://link.springer.com/chapter/10.1007/978-981-10-5828-8_43","Chapter"
"Energy Management of Smart Homes with Microgrid","Advances in Energy Systems Engineering","","","","10.1007/978-3-319-42803-1_17","Di ZhangSongsong LiuLazaros G. Papageorgiou","2017","http://link.springer.com/chapter/10.1007/978-3-319-42803-1_17","Chapter"
"Automatic Identification of Behavior Patterns in Mild Cognitive Impairments and Alzheimer’s Disease Based on Activities of Daily Living","Smart Homes and Health Telematics, Designing a Better Future: Urban Assisted Living","","","","10.1007/978-3-319-94523-1_6","Belkacem ChikhaouiMaxime LussierMathieu GagnonHélène PigotSylvain GirouxNathalie Bier","2018","http://link.springer.com/chapter/10.1007/978-3-319-94523-1_6","Chapter"
"A Low-Costed Positioning System Based on Wearable Devices for Elders and Children in a Local Area","Intelligent Information and Database Systems","","","","10.1007/978-3-319-75420-8_31","Chuan-Bi LinYung-Fa HuangLong-Xin ChenYu-Chiang ChangZ-Ming HongJong-Shin Chen","2018","http://link.springer.com/chapter/10.1007/978-3-319-75420-8_31","Chapter"
"Changes in Chinese People’s Cultural Life in New Media Environment","New Media and China's Social Development","","","","10.1007/978-981-10-3994-2_8","Huanying SongYu PanLu Liu","2017","http://link.springer.com/chapter/10.1007/978-981-10-3994-2_8","Chapter"
"Adaptive Interface for Smart Home: A New Design Approach","Ambient Assisted Living","","","","10.1007/978-3-319-54283-6_8","Francesca GullàSilvia CeccacciRoberto MenghiLorenzo CavalieriMichele Germani","2017","http://link.springer.com/chapter/10.1007/978-3-319-54283-6_8","Chapter"
"Enhance the Use of Medical Wearables Through Meaningful Data Analytics","Digital Human Modeling. Applications in Health, Safety, Ergonomics, and Risk Management: Health and Safety","","","","10.1007/978-3-319-58466-9_26","Kurt ReifferscheidXiaokun Zhang","2017","http://link.springer.com/chapter/10.1007/978-3-319-58466-9_26","Chapter"
"Extreme Learning Machine Based Location-Aware Activity Recognition","Proceedings of 2017 Chinese Intelligent Systems Conference","","","","10.1007/978-981-10-6499-9_72","Zhihao XieJie ZhangWendong XiaoChangguo SunYifang Lu","2018","http://link.springer.com/chapter/10.1007/978-981-10-6499-9_72","Chapter"
"Personalized Computer Access for People with Severe Motor Disabilities","Human Aspects of IT for the Aged Population. Aging, Design and User Experience","","","","10.1007/978-3-319-58530-7_31","Chris VeiglMartin DeinhoferBenjamin AignerKlaus Miesenberger","2017","http://link.springer.com/chapter/10.1007/978-3-319-58530-7_31","Chapter"
"Data Spaces: Combining Goal-Driven and Data-Driven Approaches in Community Decision and Negotiation Support","Group Decision and Negotiation. A Socio-Technical Perspective","","","","10.1007/978-3-319-63546-0_1","Matthias Jarke","2017","http://link.springer.com/chapter/10.1007/978-3-319-63546-0_1","Chapter"
"An Application to Improve Smart Heritage City Experience","Advances in Digital Cultural Heritage","","","","10.1007/978-3-319-75789-6_7","Adriana MarFernando MonteiroPedro PereiraJoão Martins","2018","http://link.springer.com/chapter/10.1007/978-3-319-75789-6_7","Chapter"
"A Smart Pain Management System Using Big Data Computing","Smart Societies, Infrastructure, Technologies and Applications","","","","10.1007/978-3-319-94180-6_23","Waleed Al ShehriRashid MehmoodHassan Alayyaf","2018","http://link.springer.com/chapter/10.1007/978-3-319-94180-6_23","Chapter"
"Smart Home Appliance Control via Hand Gesture Recognition Using a Depth Camera","Smart Energy Control Systems for Sustainable Buildings","","","","10.1007/978-3-319-52076-6_7","Dong-Luong DinhTae-Seong Kim","2017","http://link.springer.com/chapter/10.1007/978-3-319-52076-6_7","Chapter"
"Exploring Opportunistic Ambient Notifications in the Smart Home to Enhance Quality of Live","Enhanced Quality of Life and Smart Living","","","","10.1007/978-3-319-66188-9_13","Andreas SeidererChi Tai DangElisabeth André","2017","http://link.springer.com/chapter/10.1007/978-3-319-66188-9_13","Chapter"
"Technology and Service Usage Among Family Caregivers","Human Aspects of IT for the Aged Population. Applications, Services and Contexts","","","","10.1007/978-3-319-58536-9_33","Chaiwoo LeeCarley WardDana EllisSamantha BradyLisa D’AmbrosioJoseph F. Coughlin","2017","http://link.springer.com/chapter/10.1007/978-3-319-58536-9_33","Chapter"
"Legal Aspects of Long-Term Care in Slovenia","Long-Term Care in Europe","","","","10.1007/978-3-319-70081-6_11","Grega Strban","2018","http://link.springer.com/chapter/10.1007/978-3-319-70081-6_11","Chapter"
"How Blind People Can Manage a Remote Control System: A Case Study","Smart Objects and Technologies for Social Good","","","","10.1007/978-3-319-76111-4_8","Marina BuzziFrancesco GennaiBarbara Leporini","2018","http://link.springer.com/chapter/10.1007/978-3-319-76111-4_8","Chapter"
"Conclusions: Collective Human Rights and Low-Tech","Human Rights and Digital Technology","","","","10.1057/978-1-137-58805-0_7","Susan PerryClaudia Roda","2017","http://link.springer.com/chapter/10.1057/978-1-137-58805-0_7","Chapter"
"Agent-Based Assistance in Ambient Assisted Living Through Reinforcement Learning and Semantic Technologies","On the Move to Meaningful Internet Systems. OTM 2017 Conferences","","","","10.1007/978-3-319-69459-7_12","Nicole MerkleStefan Zander","2017","http://link.springer.com/chapter/10.1007/978-3-319-69459-7_12","Chapter"
"Mobile Healthcare and mHealth Apps","Computers Helping People with Special Needs","","","","10.1007/978-3-319-94274-2_64","Frank DeRuyterMike Jones","2018","http://link.springer.com/chapter/10.1007/978-3-319-94274-2_64","Chapter"
"Bridging Borders: Integrating Data Analytics, Modeling, Simulation, and Gaming for Interdisciplinary Assessment of Health Aspects in City Networks","City Networks","","","","10.1007/978-3-319-65338-9_8","Jayanth RaghothamaElhabib MoustaidVinutha Magal ShreenathSebastiaan Meijer","2017","http://link.springer.com/chapter/10.1007/978-3-319-65338-9_8","Chapter"
"Do We Need New Legal Personhood in the Age of Robots and AI?","Robotics, AI and the Future of Law","","","","10.1007/978-981-13-2874-9_2","Robert van den Hoven van Genderen","2018","http://link.springer.com/chapter/10.1007/978-981-13-2874-9_2","Chapter"
"Introduction: Legal and Ethical Dimensions of AI, NorMAS, and the Web of Data","AI Approaches to the Complexity of Legal Systems","","","","10.1007/978-3-030-00178-0_1","Ugo PagalloMonica PalmiraniPompeu CasanovasGiovanni SartorSerena Villata","2018","http://link.springer.com/chapter/10.1007/978-3-030-00178-0_1","Chapter"
"Italy: Simultaneous Crisis of Democracy, Innovation and Economic Efficiency","Democracy and Growth in the Twenty-first Century","","","","10.1007/978-3-030-02014-9_4","Francesco GrilloRaffaella Y. Nanetti","2018","http://link.springer.com/chapter/10.1007/978-3-030-02014-9_4","Chapter"
"Visualizing Knowledge Evolution of Emerging Information Technologies in Chronic Diseases Research","Smart Health","","","","10.1007/978-3-030-03649-2_26","Dongxiao GuKang LiXiaoyu WangChangyong Liang","2018","http://link.springer.com/chapter/10.1007/978-3-030-03649-2_26","Chapter"
"Virtualization of Health Care: The Role of Capacity Building","Health 4.0: How Virtualization and Big Data are Revolutionizing Healthcare","","","","10.1007/978-3-319-47617-9_7","Ai Keow Lim","2017","http://link.springer.com/chapter/10.1007/978-3-319-47617-9_7","Chapter"
"Designing a Social Urban Networks to Promote Smart Participation in Matera (Italy)","Citizen Empowerment and Innovation in the Data-Rich City","","","","10.1007/978-3-319-47904-0_9","Filomena PietrapertosaRoberta ChiariniPaola Clerici MaestosiClaudia MeloniCarmelina CosmiMonica Salvia","2017","http://link.springer.com/chapter/10.1007/978-3-319-47904-0_9","Chapter"
"Bringing the Developmental State Back in the Age of Exponentiality","The Political Economy of Neo-modernisation","","","","10.1007/978-3-319-91394-0_9","Seung Jin Baek","2018","http://link.springer.com/chapter/10.1007/978-3-319-91394-0_9","Chapter"
"The Global Emergence of Climate Policy","Eco-Capitalism","","","","10.1007/978-3-319-92357-4_3","Robert Guttmann","2018","http://link.springer.com/chapter/10.1007/978-3-319-92357-4_3","Chapter"
"Finance for the Elderly Care Industry: Business Mergers and Development Diversity","Annual Report on Financing Old Age Care in China (2017)","","","","10.1007/978-981-13-0968-7_8","Zhuojun CaoQin Jing","2018","http://link.springer.com/chapter/10.1007/978-981-13-0968-7_8","Chapter"
"Acceptance of Social Robots by Aging Users: Towards a Pleasure-Oriented View","Cross-Cultural Design. Methods, Tools, and Users","","","","10.1007/978-3-319-92141-9_30","Na Chen","2018","http://link.springer.com/chapter/10.1007/978-3-319-92141-9_30","Chapter"
"Confronting Common Assumptions About the Psychomotor Abilities of Older Adults Interacting with Touchscreens","Human Aspects of IT for the Aged Population. Acceptance, Communication and Participation","","","","10.1007/978-3-319-92034-4_20","Suhas Govind Joshi","2018","http://link.springer.com/chapter/10.1007/978-3-319-92034-4_20","Chapter"
"Human Algorithm","HCI International 2017 – Posters' Extended Abstracts","","","","10.1007/978-3-319-58753-0_58","Jue RenYouyang HouTat LamYang Yang","2017","http://link.springer.com/chapter/10.1007/978-3-319-58753-0_58","Chapter"
"Multilingual Low-Resourced Prototype System for Voice-Controlled Intelligent Building Applications","Trends and Advances in Information Systems and Technologies","","","","10.1007/978-3-319-77700-9_10","Alexandru CaranicaLucian GeorgescuAlexandru VulpeHoria Cucu","2018","http://link.springer.com/chapter/10.1007/978-3-319-77700-9_10","Chapter"
"Integrated Organic Growth: The Cases of Cameroon and Mauritius","China’s Impact on the African Renaissance","","","","10.1007/978-981-13-0179-7_9","Kobus JonkerBryan Robinson","2018","http://link.springer.com/chapter/10.1007/978-981-13-0179-7_9","Chapter"
"Smart and Sustainable: Lessons from Fogo Island","Smart Cities in the Mediterranean","","","","10.1007/978-3-319-54558-5_9","Mark I. Wilson","2017","http://link.springer.com/chapter/10.1007/978-3-319-54558-5_9","Chapter"
"IT and the Consumer","The Web at Graduation and Beyond","","","","10.1007/978-3-319-60161-8_3","Gottfried VossenFrank SchönthalerStuart Dillon","2017","http://link.springer.com/chapter/10.1007/978-3-319-60161-8_3","Chapter"
"Novel Unobtrusive Approach for Sleep Monitoring Using Fiber Optics in an Ambient Assisted Living Platform","Enhanced Quality of Life and Smart Living","","","","10.1007/978-3-319-66188-9_5","Ibrahim SadekJoaquim BellmuntMartin KodyšBessam AbdulrazakMounir Mokhtari","2017","http://link.springer.com/chapter/10.1007/978-3-319-66188-9_5","Chapter"
"Key Technological Disruptors","Insurance Transformed","","","","10.1007/978-3-319-63835-5_2","Michael Naylor","2017","http://link.springer.com/chapter/10.1007/978-3-319-63835-5_2","Chapter"
"Mobile Phones and/or Smartphones and Their Use in the Management of Dementia – Findings from the Research Studies","Digital Nations – Smart Cities, Innovation, and Sustainability","","","","10.1007/978-3-319-68557-1_4","Blanka Klimova","2017","http://link.springer.com/chapter/10.1007/978-3-319-68557-1_4","Chapter"
"Combining Public and Private Strategies Towards Sustainable and Responsible Mobility","Towards a Sustainable Economy","","","","10.1007/978-3-319-79060-2_8","Danielle AttiasSylvie Mira Bonnardel","2018","http://link.springer.com/chapter/10.1007/978-3-319-79060-2_8","Chapter"
"Voices and Views of Informal Caregivers: Investigating Ambient Assisted Living Technologies","Ambient Intelligence","","","","10.1007/978-3-319-56997-0_8","Christina JaschinskiSomaya Ben Allouch","2017","http://link.springer.com/chapter/10.1007/978-3-319-56997-0_8","Chapter"
"A Transparent Home Sensors/Actuators Layer for Health and Well-Being Services","eHealth 360°","","","","10.1007/978-3-319-49655-9_5","Philippe TanguyChristophe LohrJérôme Kerdreux","2017","http://link.springer.com/chapter/10.1007/978-3-319-49655-9_5","Chapter"
"Research on User Mental Model Acquisition Based on Multidimensional Data Collaborative Analysis in Product Service System Innovation Process","Engineering Psychology and Cognitive Ergonomics: Cognition and Design","","","","10.1007/978-3-319-58475-1_3","Jinhua DouJingyan Qin","2017","http://link.springer.com/chapter/10.1007/978-3-319-58475-1_3","Chapter"
"Elderly Health Care - Security and Privacy Issue","Data Science","","","","10.1007/978-981-10-6385-5_24","Kaiyu WanVangalur AlagarPeter Oyikanmi","2017","http://link.springer.com/chapter/10.1007/978-981-10-6385-5_24","Chapter"
"Industrial Applications of Machine Learning","Machine Learning for Decision Makers","","","","10.1007/978-1-4842-2988-0_5","Patanjali Kashyap","2017","http://link.springer.com/chapter/10.1007/978-1-4842-2988-0_5","Chapter"
"Arianna: Scalable Human Activity Recognition by Reasoning with a Network of Ontologies","AI*IA 2018 – Advances in Artificial Intelligence","","","","10.1007/978-3-030-03840-3_7","Syed Yusha KareemLuca BuoncompagniFulvio Mastrogiovanni","2018","http://link.springer.com/chapter/10.1007/978-3-030-03840-3_7","Chapter"
"Can Technology Improve Medication Adherence in Older People with Dementia?","Smart Homes and Health Telematics, Designing a Better Future: Urban Assisted Living","","","","10.1007/978-3-319-94523-1_1","Najwan El-SaifiWendy MoyleCindy JonesHaitham Tuffaha","2018","http://link.springer.com/chapter/10.1007/978-3-319-94523-1_1","Chapter"
"Designing-by-Debate: A Blueprint for Responsible Data-Driven Research & Innovation","Responsible Research and Innovation Actions in Science Education, Gender and Ethics","","","","10.1007/978-3-319-73207-7_8","Jef AusloosRob HeymanNatalie BertelsJo PiersonPeggy Valcke","2018","http://link.springer.com/chapter/10.1007/978-3-319-73207-7_8","Chapter"
"Capturing Activities of Daily Living for Elderly at Home Based on Environment Change and Speech Dialog","Digital Human Modeling. Applications in Health, Safety, Ergonomics, and Risk Management: Health and Safety","","","","10.1007/978-3-319-58466-9_18","Kazunari TamamizuSeiji SakakibaraSachio SaikiMasahide NakamuraKiyoshi Yasuda","2017","http://link.springer.com/chapter/10.1007/978-3-319-58466-9_18","Chapter"
"Support in Times of Digitization","Developing Support Technologies","","","","10.1007/978-3-030-01836-8_28","Athanasios KarafillidisRobert Weidner","2018","http://link.springer.com/chapter/10.1007/978-3-030-01836-8_28","Chapter"
"Housing and the Environments of Ageing","Ageing in Australia","","","","10.1007/978-1-4939-6466-6_10","Debbie Faulkner","2017","http://link.springer.com/chapter/10.1007/978-1-4939-6466-6_10","Chapter"
"A Cloud Architecture for Service Robots","Cooperative Design, Visualization, and Engineering","","","","10.1007/978-3-030-00560-3_7","Zuozhong YinJihong LiuChao ZhaoXin Ge","2018","http://link.springer.com/chapter/10.1007/978-3-030-00560-3_7","Chapter"
"Sustainable Banking: Finance in the Circular Economy","Investing in Resource Efficiency","","","","10.1007/978-3-319-78867-8_9","Liesbet GoovaertsArnold Verbeek","2018","http://link.springer.com/chapter/10.1007/978-3-319-78867-8_9","Chapter"
"Attributes of an Entrepreneurial Learning City Region","Entrepreneurial Learning City Regions","","","","10.1007/978-3-319-61130-3_1","Norman Longworth","2018","http://link.springer.com/chapter/10.1007/978-3-319-61130-3_1","Chapter"
"Land, Livelihoods and Health: Marginalization in Globalizing Delhi","Marginalization in Globalizing Delhi: Issues of Land, Livelihoods and Health","","","","10.1007/978-81-322-3583-5_1","Sanghmitra S. AcharyaSucharita SenMilap PuniaSunita Reddy","2017","http://link.springer.com/chapter/10.1007/978-81-322-3583-5_1","Chapter"
"The Role of Socially Assistive Robots in Elderly Wellbeing: A Systematic Review","Cross-Cultural Design","","","","10.1007/978-3-319-57931-3_54","Reza KachouieSima SedighadeliAmin B. Abkenar","2017","http://link.springer.com/chapter/10.1007/978-3-319-57931-3_54","Chapter"
"Levels of Air Pollution in Lucknow, Uttar Pradesh","Sustainable Smart Cities in India","","","","10.1007/978-3-319-47145-7_41","Ruchi Tiwari","2017","http://link.springer.com/chapter/10.1007/978-3-319-47145-7_41","Chapter"
"A Longitudinal Study on Comprehensive Reforming and Experimenting District of Education System","Reform and Development of Educational System","","","","10.1007/978-3-662-55525-5_4","Chen HuangLei TaoLinli HeShunguang YangShuang GongQian ZhaoWei LiLing Li","2018","http://link.springer.com/chapter/10.1007/978-3-662-55525-5_4","Chapter"
"Digi-Tel—Bespoke Technology for Connected City of Tel-Aviv","Citizen Empowerment and Innovation in the Data-Rich City","","","","10.1007/978-3-319-47904-0_10","Zvi Weinstein","2017","http://link.springer.com/chapter/10.1007/978-3-319-47904-0_10","Chapter"
"Smart Mirror Devices","Innovations for Community Services","","","","10.1007/978-3-319-93408-2_14","Sven Von HollenBenjamin Reeh","2018","http://link.springer.com/chapter/10.1007/978-3-319-93408-2_14","Chapter"
"Big Data for Urban Health and Well-Being","Big Data for Urban Sustainability","","","","10.1007/978-3-319-73610-5_7","Stephen Jia WangPatrick Moriarty","2018","http://link.springer.com/chapter/10.1007/978-3-319-73610-5_7","Chapter"
"Technological Approach for Early and Unobtrusive Detection of Possible Health Changes Toward More Effective Treatment","Smart Homes and Health Telematics, Designing a Better Future: Urban Assisted Living","","","","10.1007/978-3-319-94523-1_5","Firas KaddachiHamdi AloulouBessam AbdulrazakPhilippe FraisseMounir Mokhtari","2018","http://link.springer.com/chapter/10.1007/978-3-319-94523-1_5","Chapter"
"Collecting Bus Locations by Users: A Crowdsourcing Model to Estimate Operation Status of Bus Transit Service","Distributed, Ambient and Pervasive Interactions: Understanding Humans","","","","10.1007/978-3-319-91125-0_14","Kenro AiharaPiao BinHajime ImuraAtsuhiro TakasuYuzuru Tanaka","2018","http://link.springer.com/chapter/10.1007/978-3-319-91125-0_14","Chapter"
"Monitoring Activities of Daily Living Using Audio Analysis and a RaspberryPI: A Use Case on Bathroom Activity Monitoring","Information and Communication Technologies for Ageing Well and e-Health","","","","10.1007/978-3-319-62704-5_2","Georgios SiantikosTheodoros GiannakopoulosStasinos Konstantopoulos","2017","http://link.springer.com/chapter/10.1007/978-3-319-62704-5_2","Chapter"
"Design Fictions: A Tool for Debating Societal, Legal and Ethical Aspects of Personal and Pervasive Health Systems","eHealth 360°","","","","10.1007/978-3-319-49655-9_48","Emmanuel TseklevesAndy DarbyAnna WhicherPiotr Swiatek","2017","http://link.springer.com/chapter/10.1007/978-3-319-49655-9_48","Chapter"
"Optimization of Actuarial Calculation Processes by Application of Stochastic Methods","Innovations in Smart Cities and Applications","","","","10.1007/978-3-319-74500-8_93","Jamal ZahiMerieme Samaoui","2018","http://link.springer.com/chapter/10.1007/978-3-319-74500-8_93","Chapter"
"Design of ANFIS Based E-Health Care System for Cardio Vascular Disease Detection","Recent Developments in Intelligent Systems and Interactive Applications","","","","10.1007/978-3-319-49568-2_63","Lokanath SarangiMihir Narayan MohantySrikanta Patnaik","2017","http://link.springer.com/chapter/10.1007/978-3-319-49568-2_63","Chapter"
"Urban Informality and Planning: Challenges to Mainstreaming Resilience in Indian Cities","Resilience-Oriented Urban Planning","","","","10.1007/978-3-319-75798-8_3","Minal PathakDarshini Mahadevia","2018","http://link.springer.com/chapter/10.1007/978-3-319-75798-8_3","Chapter"
"A Descriptive Tomographic Content Analysis Method in Chronic Disease Knowledge Network: An Application to Hypertension","Smart Health","","","","10.1007/978-3-030-03649-2_30","Liqin ZhouLu AnZhichao BaZhiyuan Li","2018","http://link.springer.com/chapter/10.1007/978-3-030-03649-2_30","Chapter"
"E-Engagement in Hong Kong","E-Democracy for Smart Cities","","","","10.1007/978-981-10-4035-1_5","Sujata S. GovadaFrank WongTimothy RodgersHo Yan Claudia ChowKrista Busa","2017","http://link.springer.com/chapter/10.1007/978-981-10-4035-1_5","Chapter"
"Educational Methods Using Intergenerational Interaction to Fight Ageism","Contemporary Perspectives on Ageism","","","","10.1007/978-3-319-73820-8_23","María del Carmen RequenaHannah J. SwiftLaura NaegeleMarc ZwambornSusan MetzWilco P. H. BosemsJoost van Hoof","2018","http://link.springer.com/chapter/10.1007/978-3-319-73820-8_23","Chapter"
