Item Title,Publication Title,Book Series Title,Journal Volume,Journal Issue,Item DOI,Authors,Publication Year,URL,Content Type
"Design for All in the Ambient Intelligence Environment","Computers Helping People with Special Needs","","","","10.1007/978-3-540-70540-6_16","P. L. EmilianiM. BilliL. BurzagliF. Gabbanini","2008","http://link.springer.com/chapter/10.1007/978-3-540-70540-6_16","Chapter"
"Living Labs as Educational Tool for Ambient Intelligence","Ambient Intelligence","","","","10.1007/978-3-642-34898-3_27","Ben KröseMettina VeenstraSaskia RobbenMarije Kanis","2012","http://link.springer.com/chapter/10.1007/978-3-642-34898-3_27","Chapter"
"Ambient Assisted Living","3rd Symposium of Ubiquitous Computing and Ambient Intelligence 2008","","","","10.1007/978-3-540-85867-6_10","Ricardo CostaDavide CarneiroPaulo NovaisLuís LimaJosé MachadoAlberto MarquesJosé Neves","2009","http://link.springer.com/chapter/10.1007/978-3-540-85867-6_10","Chapter"
"Heterogeneous Multi-sensor Fusion Based on an Evidential Network for Fall Detection","Toward Useful Services for Elderly and People with Disabilities","","","","10.1007/978-3-642-21535-3_42","Paulo Armando Cavalcante AguilarJerome BoudyDan IstrateHamid MedjahedBernadette DorizziJoão Cesar Moura MotaJean Louis BaldingerToufik GuettariImad Belfeki","2011","http://link.springer.com/chapter/10.1007/978-3-642-21535-3_42","Chapter"
"Diagnostic and Accessibility Based User Modelling","User Modeling and Adaptation for Daily Routines","","","","10.1007/978-1-4471-4778-7_3","Stefan P. CarmienAlberto Martínez Cantera","2013","http://link.springer.com/chapter/10.1007/978-1-4471-4778-7_3","Chapter"
"An Open Framework for Immersive and Non-immersive Accessibility Simulation for Smart Living Spaces","Impact Analysis of Solutions for Chronic Disease Prevention and Management","","","","10.1007/978-3-642-30779-9_47","Athanasios TsakirisPanagiotis MoschonasKonstantinos MoustakasDimitrios Tzovaras","2012","http://link.springer.com/chapter/10.1007/978-3-642-30779-9_47","Chapter"
"Probabilistic Situation Modeling from Ambient Sensors in a Health Condition Monitoring System","Ubiquitous Computing and Ambient Intelligence. Context-Awareness and Context-Driven Interaction","","","","10.1007/978-3-319-03176-7_23","Gustavo LópezRamón Brena","2013","http://link.springer.com/chapter/10.1007/978-3-319-03176-7_23","Chapter"
"Sensing and Sensor Fundamentals","Sensor Technologies","","","","10.1007/978-1-4302-6014-1_2","Michael J. McGrathCliodhna Ní Scanaill","2013","http://link.springer.com/chapter/10.1007/978-1-4302-6014-1_2","Chapter"
"Evaluation of PhonAge: An Adapted Smartphone Interface for Elderly People","Human-Computer Interaction – INTERACT 2013","","","","10.1007/978-3-642-40498-6_44","Farah ArabYasir MalikBessam Abdulrazak","2013","http://link.springer.com/chapter/10.1007/978-3-642-40498-6_44","Chapter"
"A Portable and Self-presenting Robotic Ecology HRI Testbed","Evolving Ambient Intelligence","","","","10.1007/978-3-319-04406-4_14","Anara SandygulovaMauro Dragone","2013","http://link.springer.com/chapter/10.1007/978-3-319-04406-4_14","Chapter"
"Context-Aware Recommender Systems Influenced by the Users’ Health-Related Data","User Modeling and Adaptation for Daily Routines","","","","10.1007/978-1-4471-4778-7_6","Martín López-NoresYolanda Blanco-FernándezJosé J. Pazos-AriasManuela I. Martín-Vicente","2013","http://link.springer.com/chapter/10.1007/978-1-4471-4778-7_6","Chapter"
"How Can a Robot Attract the Attention of Its Human Partner? A Comparative Study over Different Modalities for Attracting Attention","Social Robotics","","","","10.1007/978-3-642-34103-8_29","Elena TortaJim van HeumenRaymond H. CuijpersJames F. Juola","2012","http://link.springer.com/chapter/10.1007/978-3-642-34103-8_29","Chapter"
"Interaction Mechanism for Language Learning for Elderly People through Mobile Devices","Highlights in Practical Applications of Agents and Multiagent Systems","","","","10.1007/978-3-642-19917-2_40","Antonia MacarroEmma VillafainaAna María PintoJavier Bajo","2011","http://link.springer.com/chapter/10.1007/978-3-642-19917-2_40","Chapter"
"Real-Time Interactive Medical Consultation Using a Pervasive Healthcare Architecture","Toward Useful Services for Elderly and People with Disabilities","","","","10.1007/978-3-642-21535-3_29","Bingchuan YuanJohn Herbert","2011","http://link.springer.com/chapter/10.1007/978-3-642-21535-3_29","Chapter"
"Ambient Intelligence Acceptable by the Elderly","User-Centric Technologies and Applications","","","","10.1007/978-3-642-19908-0_11","David Zejda","2011","http://link.springer.com/chapter/10.1007/978-3-642-19908-0_11","Chapter"
"An Approach to and Evaluations of Assisted Living Systems Using Ambient Intelligence for Emergency Monitoring and Prevention","Universal Access in Human-Computer Interaction. Intelligent and Ubiquitous Interaction Environments","","","","10.1007/978-3-642-02710-9_23","Thomas KleinbergerAndreas JedlitschkaHolger StorfSilke Steinbach-NordmannStephan Prueckner","2009","http://link.springer.com/chapter/10.1007/978-3-642-02710-9_23","Chapter"
"Ambient Intelligence, between Heaven and Hell. A Transformative Critical Room?","Gender Designs IT","","","","10.1007/978-3-531-90295-1_4","Dr. Cecile K. M. Crutzen","2007","http://link.springer.com/chapter/10.1007/978-3-531-90295-1_4","Chapter"
"A Quantitative Method for Revealing and Comparing Places in the Home","UbiComp 2006: Ubiquitous Computing","","","","10.1007/11853565_1","Ryan AipperspachTye RattenburyAllison WoodruffJohn Canny","2006","http://link.springer.com/chapter/10.1007/11853565_1","Chapter"
"Strategic Technological Pathways for Sustainable Development","Clean Production","","","","10.1007/978-3-642-79940-2_3","Giancarlo Barbiroli","1996","http://link.springer.com/chapter/10.1007/978-3-642-79940-2_3","Chapter"
"An Automatic, Time-Based, Secure Pairing Protocol for Passive RFID","RFID. Security and Privacy","","","","10.1007/978-3-642-25286-0_8","George T. AmariucaiClifford BergmanYong Guan","2012","http://link.springer.com/chapter/10.1007/978-3-642-25286-0_8","Chapter"
"universAAL – An Open and Consolidated AAL Platform","Ambient Assisted Living","","","","10.1007/978-3-642-18167-2_10","Sten HankeChristopher MayerOliver HoeftbergerHenriette BoosReiner WichertMohammed-R. TazariPeter WolfFrancesco Furfari","2011","http://link.springer.com/chapter/10.1007/978-3-642-18167-2_10","Chapter"
"A User Study for an Attention-Directed Robot for Telepresence","Inclusive Society: Health and Wellbeing in the Community, and Care at Home","","","","10.1007/978-3-642-39470-6_14","Rui YanKeng Peng TeeYuanwei ChuaZhiyong Huang","2013","http://link.springer.com/chapter/10.1007/978-3-642-39470-6_14","Chapter"
"IP Multimedia Subsystem Technology for Ambient Assisted Living","Ambient Assistive Health and Wellness Management in the Heart of the City","","","","10.1007/978-3-642-02868-7_36","Pedro Antonio MorenoMa. Elena HernandoAntoine de PoorterRuth PallaresEnrique J. Gómez","2009","http://link.springer.com/chapter/10.1007/978-3-642-02868-7_36","Chapter"
"Cognitive Modeling and Support for Ambient Assistance","Information Systems: Methods, Models, and Applications","","","","10.1007/978-3-642-38370-0_9","Judith MichaelAndreas GrießerTina StroblHeinrich C. Mayr","2013","http://link.springer.com/chapter/10.1007/978-3-642-38370-0_9","Chapter"
"A Fuzzy Decision Support Language for Building Mobile DSSs for Healthcare Applications","Wireless Mobile Communication and Healthcare","","","","10.1007/978-3-642-37893-5_30","Aniello MinutoloMassimo EspositoGiuseppe De Pietro","2013","http://link.springer.com/chapter/10.1007/978-3-642-37893-5_30","Chapter"
"Compound Personal and Residential Infrastructure for Ubiquitous Health Supervision","Human – Computer Systems Interaction: Backgrounds and Applications 2","","","","10.1007/978-3-642-23187-2_33","P. Augustyniak","2012","http://link.springer.com/chapter/10.1007/978-3-642-23187-2_33","Chapter"
"Conversational Agents as Full-Pledged BDI Agents for Ambient Intelligence","Ambient Intelligence - Software and Applications","","","","10.1007/978-3-319-00566-9_28","Aida MustaphaMohd Sharifuddin AhmadAzhana Ahmad","2013","http://link.springer.com/chapter/10.1007/978-3-319-00566-9_28","Chapter"
"Introduction","Integration of Preference Analysis Methods into Quality Function Deployment","","","","10.1007/978-3-8349-7075-6_1","Samah Abu-Assab","2012","http://link.springer.com/chapter/10.1007/978-3-8349-7075-6_1","Chapter"
"Instinctive Computing","Artifical Intelligence for Human Computing","","","","10.1007/978-3-540-72348-6_2","Yang Cai","2007","http://link.springer.com/chapter/10.1007/978-3-540-72348-6_2","Chapter"
"Overview of Indoor Positioning Technologies for Context Aware AAL Applications","Ambient Assisted Living","","","","10.1007/978-3-642-18167-2_19","Corina K. SchindhelmAsa MacWilliams","2011","http://link.springer.com/chapter/10.1007/978-3-642-18167-2_19","Chapter"
"Care-O-bot® 3 – Vision of a Robot Butler","Your Virtual Butler","","","","10.1007/978-3-642-37346-6_9","Ulrich ReiserTheo JacobsGeorg ArbeiterChristopher ParlitzKerstin Dautenhahn","2013","http://link.springer.com/chapter/10.1007/978-3-642-37346-6_9","Chapter"
"Supporting Care Networks Using the “Daily Care Journal”","Inclusive Society: Health and Wellbeing in the Community, and Care at Home","","","","10.1007/978-3-642-39470-6_41","Manfred WojciechowskiMarkus Wiedeler","2013","http://link.springer.com/chapter/10.1007/978-3-642-39470-6_41","Chapter"
"Activity Recognition and Activity Level Estimation for Context-Based Prompting System of Mild Cognitive Impairment Patients","Inclusive Society: Health and Wellbeing in the Community, and Care at Home","","","","10.1007/978-3-642-39470-6_7","Chung-Tse LiuSteen J. HsuChia-Tai Chan","2013","http://link.springer.com/chapter/10.1007/978-3-642-39470-6_7","Chapter"
"Assessing Behavioral Responses in Persuasive Ubiquitous Systems","Inclusive Society: Health and Wellbeing in the Community, and Care at Home","","","","10.1007/978-3-642-39470-6_22","Duckki LeeSumi HelalYunsick Sung","2013","http://link.springer.com/chapter/10.1007/978-3-642-39470-6_22","Chapter"
"Wireless Sensors and Sensors Network","Intelligent Sensing, Instrumentation and Measurements","","","","10.1007/978-3-642-37027-4_3","Subhas Chandra Mukhopadhyay","2013","http://link.springer.com/chapter/10.1007/978-3-642-37027-4_3","Chapter"
"Behavior Recognition for Elderly People in Large-Scale Deployment","Inclusive Society: Health and Wellbeing in the Community, and Care at Home","","","","10.1007/978-3-642-39470-6_8","Romain EndelinStéphane RenouardThibaut TiberghienHamdi AloulouMounir Mokhtari","2013","http://link.springer.com/chapter/10.1007/978-3-642-39470-6_8","Chapter"
"Trends in Individual Trajectories of Health Limitations: A Study based on the German Socio-Economic Panel for the Periods 1984 to 1987 and 1995 to 1998","Ageing, Care Need and Quality of Life","","","","10.1007/978-3-531-92335-2_10","Gabriele DoblhammerUta Ziegler","2010","http://link.springer.com/chapter/10.1007/978-3-531-92335-2_10","Chapter"
"Leading Schools in High Poverty Neighborhoods: The National College for School Leadership and Beyond","International Handbook of Urban Education","","","","10.1007/978-1-4020-5199-9_54","Pat Thomson","2007","http://link.springer.com/chapter/10.1007/978-1-4020-5199-9_54","Chapter"
"Virtual Center for the Elderly: Lessons Learned","Distributed Computing, Artificial Intelligence, Bioinformatics, Soft Computing, and Ambient Assisted Living","","","","10.1007/978-3-642-02481-8_109","Laura M. RoaJavier Reina-TosinaMiguel A. Estudillo","2009","http://link.springer.com/chapter/10.1007/978-3-642-02481-8_109","Chapter"
"Multi-modal Non-intrusive Sleep Pattern Recognition in Elder Assistive Environment","Impact Analysis of Solutions for Chronic Disease Prevention and Management","","","","10.1007/978-3-642-30779-9_17","Hongbo NiBessam AbdulrazakDaqing ZhangShu WuXingshe ZhouKejian MiaoDaifei Han","2012","http://link.springer.com/chapter/10.1007/978-3-642-30779-9_17","Chapter"
"Adaptation Technologies to Support Daily Living for All","User Modeling and Adaptation for Daily Routines","","","","10.1007/978-1-4471-4778-7_1","Estefanía MartínPablo A. HayaRosa M. Carro","2013","http://link.springer.com/chapter/10.1007/978-1-4471-4778-7_1","Chapter"
"Requirements for the Deployment of Sensor Based Recognition Systems for Ambient Assistive Living","Aging Friendly Technology for Health and Independence","","","","10.1007/978-3-642-13778-5_27","Jit BiswasMatthias BaumgartenAndrei TolstikovAung Aung Phyo WaiChris NugentLiming ChenMark Donnelly","2010","http://link.springer.com/chapter/10.1007/978-3-642-13778-5_27","Chapter"
"ECG Based Patient Recognition Model for Smart Healthcare Systems","Systems Modeling and Simulation: Theory and Applications","","","","10.1007/978-3-540-30585-9_18","Tae Seon KimChul Hong Min","2005","http://link.springer.com/chapter/10.1007/978-3-540-30585-9_18","Chapter"
"Movement Monitoring in the HomeCare System","World Congress on Medical Physics and Biomedical Engineering, September 7 - 12, 2009, Munich, Germany","","","","10.1007/978-3-642-03904-1_99","M. Cerny","2009","http://link.springer.com/chapter/10.1007/978-3-642-03904-1_99","Chapter"
"User-Centered Ubiquitous Multi-Agent Model for e-Health Web-Based Recommender Applications Development","Highlights on Practical Applications of Agents and Multi-Agent Systems","","","","10.1007/978-3-642-38061-7_40","Santiago ÁlvarezOscar SalazarDemetrio Ovalle","2013","http://link.springer.com/chapter/10.1007/978-3-642-38061-7_40","Chapter"
"Mobile Robot Platform to track User Movement and Behaviour","Evaluating AAL Systems Through Competitive Benchmarking","","","","10.1007/978-3-642-41043-7_9","Melvin IskenBjoern BorgmannAndreas Hein","2013","http://link.springer.com/chapter/10.1007/978-3-642-41043-7_9","Chapter"
"A Fuzzy-Based Context Modeling and Reasoning Framework for CARA Pervasive Healthcare","Impact Analysis of Solutions for Chronic Disease Prevention and Management","","","","10.1007/978-3-642-30779-9_38","Bingchuan YuanJohn Herbert","2012","http://link.springer.com/chapter/10.1007/978-3-642-30779-9_38","Chapter"
"Description of a Few Projects","Intelligent Sensing, Instrumentation and Measurements","","","","10.1007/978-3-642-37027-4_7","Subhas Chandra Mukhopadhyay","2013","http://link.springer.com/chapter/10.1007/978-3-642-37027-4_7","Chapter"
"Mobile Health Access for Diabetics in Rural Areas of Turkey – Results of a Survey","Electronic Healthcare","","","","10.1007/978-3-642-11745-9_3","Emine SekerMarco Savini","2010","http://link.springer.com/chapter/10.1007/978-3-642-11745-9_3","Chapter"
"The Role of ICT in a Healthcare Moving from “Clinical-Centric” to “Patient-Centric”","Impact Analysis of Solutions for Chronic Disease Prevention and Management","","","","10.1007/978-3-642-30779-9_37","Silvio Bonfiglio","2012","http://link.springer.com/chapter/10.1007/978-3-642-30779-9_37","Chapter"
"Design for All Approach with the Aim to Support Autonomous Living for Elderly People in Ordinary Residences – An Implementation Strategy","Universal Access in Human-Computer Interaction. Intelligent and Ubiquitous Interaction Environments","","","","10.1007/978-3-642-02710-9_13","Claes Tjäder","2009","http://link.springer.com/chapter/10.1007/978-3-642-02710-9_13","Chapter"
"Big Data Implications for Industry","Big Data Imperatives","","","","10.1007/978-1-4302-4873-6_3","Soumendra MohantyMadhu JagadeeshHarsha Srivatsa","2013","http://link.springer.com/chapter/10.1007/978-1-4302-4873-6_3","Chapter"
"Bejeweling the Clandestine Body/Bawdy: The Miniature Spaces of Sense and Sensibility","Austen’s Unbecoming Conjunctions","","","","10.1007/978-1-137-09853-5_2","Jillian Heydt-Stevenson","2005","http://link.springer.com/chapter/10.1007/978-1-137-09853-5_2","Chapter"
"Developing Home Care Intelligent Environments: From Theory to Practice","7th International Conference on Practical Applications of Agents and Multi-Agent Systems (PAAMS 2009)","","","","10.1007/978-3-642-00487-2_2","J. A. Fraile NietoM. E. Beato GutiérrezB. Pérez Lancho","2009","http://link.springer.com/chapter/10.1007/978-3-642-00487-2_2","Chapter"
"Towards an Acceptance Model for AAL","Human Factors in Computing and Informatics","","","","10.1007/978-3-642-39062-3_48","Gerhard LeitnerOana MitreaAnton J. Fercher","2013","http://link.springer.com/chapter/10.1007/978-3-642-39062-3_48","Chapter"
"Wearable Sensors","Autonomous Sensor Networks","","","","10.1007/5346_2012_28","Robert FosterTuba YilmazMax MunozYang Hao","2013","http://link.springer.com/chapter/10.1007/5346_2012_28","Chapter"
"Human Behavior Recognition by a Mobile Robot Following Human Subjects","Evaluating AAL Systems Through Competitive Benchmarking","","","","10.1007/978-3-642-37419-7_13","Myagmarbayar NerguiNevrez ImamogluYuki YoshidaJose GonzalezMasashi SekineKazuya KawamuraWenwei Yu","2013","http://link.springer.com/chapter/10.1007/978-3-642-37419-7_13","Chapter"
"Detecting Human Movement by Differential Air Pressure Sensing in HVAC System Ductwork: An Exploration in Infrastructure Mediated Sensing","Pervasive Computing","","","","10.1007/978-3-540-79576-6_1","Shwetak N. PatelMatthew S. ReynoldsGregory D. Abowd","2008","http://link.springer.com/chapter/10.1007/978-3-540-79576-6_1","Chapter"
"ADL Monitoring System Using FSR Arrays and Optional 3-Axis Accelerometer","Ambient Assistive Health and Wellness Management in the Heart of the City","","","","10.1007/978-3-642-02868-7_27","Minho KimJaewon JangSa-kwang SongHo-Youl JungSeon-Hee ParkSoo-Jun Park","2009","http://link.springer.com/chapter/10.1007/978-3-642-02868-7_27","Chapter"
"Towards Fuzzy Transfer Learning for Intelligent Environments","Ambient Intelligence","","","","10.1007/978-3-642-34898-3_10","Jethro ShellSimon Coupland","2012","http://link.springer.com/chapter/10.1007/978-3-642-34898-3_10","Chapter"
"Agents in Home Care: A Case Study","Hybrid Artificial Intelligence Systems","","","","10.1007/978-3-642-02319-4_1","Juan A. FraileDante I. TapiaSara RodríguezJuan M. Corchado","2009","http://link.springer.com/chapter/10.1007/978-3-642-02319-4_1","Chapter"
"iTV as a Platform for Rich Multimedia Reminders for People with Dementia","Changing Television Environments","","","","10.1007/978-3-540-69478-6_41","Alex CarmichaelMark RiceStephen LindsayPatrick Olivier","2008","http://link.springer.com/chapter/10.1007/978-3-540-69478-6_41","Chapter"
"Technical Expertise and Its Influence on the Acceptance of Future Medical Technologies: What Is Influencing What to Which Extent?","HCI in Work and Learning, Life and Leisure","","","","10.1007/978-3-642-16607-5_40","Martina ZiefleAnne Kathrin Schaar","2010","http://link.springer.com/chapter/10.1007/978-3-642-16607-5_40","Chapter"
"Discussion and Interpretation","Green Information Systems in the Residential Sector","","","","10.1007/978-3-642-36769-4_7","Philipp Wunderlich","2013","http://link.springer.com/chapter/10.1007/978-3-642-36769-4_7","Chapter"
"Why Trust Is Hard – Challenges in e-Mediated Services","Trusting Agents for Trusting Electronic Societies","","","","10.1007/11532095_11","Christer RindebäckRune Gustavsson","2005","http://link.springer.com/chapter/10.1007/11532095_11","Chapter"
"Modelling Context Information with ORM","On the Move to Meaningful Internet Systems 2005: OTM 2005 Workshops","","","","10.1007/11575863_82","Karen HenricksenJadwiga IndulskaTed McFadden","2005","http://link.springer.com/chapter/10.1007/11575863_82","Chapter"
"Home Based Assistive Technologies for People with Mild Dementia","Pervasive Computing for Quality of Life Enhancement","","","","10.1007/978-3-540-73035-4_7","Chris NugentMaurice MulvennaFerial MoelaertBirgitta Bergvall-KårebornFranka MeilandDavid CraigRichard DaviesAnnika ReinersmannMarike HettingaAnna-Lena AnderssonRose-Marie DröesJohan E. Bengtsson","2007","http://link.springer.com/chapter/10.1007/978-3-540-73035-4_7","Chapter"
"Oasis: An Architecture for Simplified Data Management and Disconnected Operation","Organic and Pervasive Computing – ARCS 2004","","","","10.1007/978-3-540-24714-2_9","Anthony LaMarcaMaya Rodrig","2004","http://link.springer.com/chapter/10.1007/978-3-540-24714-2_9","Chapter"
"Design and its Contexts","Design","","","","10.1007/3-7643-7681-3_6","","2005","http://link.springer.com/chapter/10.1007/3-7643-7681-3_6","Chapter"
"Personalized Healthcare Self-management Using Social Persuasion","Impact Analysis of Solutions for Chronic Disease Prevention and Management","","","","10.1007/978-3-642-30779-9_9","Hamid MukhtarArshad AliSungyoung LeeDjamel Belaïd","2012","http://link.springer.com/chapter/10.1007/978-3-642-30779-9_9","Chapter"
"Infrastructures and Their Discontents: Implications for Ubicomp","UbiComp 2004: Ubiquitous Computing","","","","10.1007/978-3-540-30119-6_25","Scott D. MainwaringMichele F. ChangKen Anderson","2004","http://link.springer.com/chapter/10.1007/978-3-540-30119-6_25","Chapter"
"Improving Context-Awareness in a Healthcare Multi-Agent System","Trends in Practical Applications of Agents and Multiagent Systems","","","","10.1007/978-3-642-19931-8_1","Ricardo S. AlonsoDante I. TapiaÓscar GarcíaDavid SanchoMiguel Sánchez","2011","http://link.springer.com/chapter/10.1007/978-3-642-19931-8_1","Chapter"
"Adaptive Model of Cardiovascular System: Realization and Signal Database","Information Technology in Bio- and Medical Informatics","","","","10.1007/978-3-642-40093-3_11","Jan HavlíkMiroslav LožekMatouš PokornýJakub ParákPetr HuňkaLenka Lhotská","2013","http://link.springer.com/chapter/10.1007/978-3-642-40093-3_11","Chapter"
"Intelligent Agents and Wireless Sensor Networks: A Healthcare Telemonitoring System","Trends in Practical Applications of Agents and Multiagent Systems","","","","10.1007/978-3-642-12433-4_51","Ricardo S. AlonsoOscar GarcíaCarolina ZatoOscar GilFernando De la Prieta","2010","http://link.springer.com/chapter/10.1007/978-3-642-12433-4_51","Chapter"
"HealthQuest: Technology That Encourages Physical Activity in the Workplace","Aging Friendly Technology for Health and Independence","","","","10.1007/978-3-642-13778-5_38","Hyungsin KimMatthew SwartsSeunghyun “Tina” LeeEllen Yi-Luen Do","2010","http://link.springer.com/chapter/10.1007/978-3-642-13778-5_38","Chapter"
"Modular Hardware Design and Realization for Vital Signs Monitoring","Ambient Assisted Living and Home Care","","","","10.1007/978-3-642-35395-6_27","Jan HavlíkLenka LhotskáJakub ParákMatouš PokornýJan DvořakZdeněk Horčík","2012","http://link.springer.com/chapter/10.1007/978-3-642-35395-6_27","Chapter"
"Embedded Activity Monitoring Methods","Activity Recognition in Pervasive Intelligent Environments","","","","10.2991/978-94-91216-05-3_13","Niket ShahMaulik KapuriaKimberly Newman","2011","http://link.springer.com/chapter/10.2991/978-94-91216-05-3_13","Chapter"
"Identifying Phases of Gait and Development of Walking Model from Pressure and Accelerometer Data and It’s Ramifications in Elderly Walking","Inclusive Society: Health and Wellbeing in the Community, and Care at Home","","","","10.1007/978-3-642-39470-6_35","Ferdaus KawsarJahangir A. MajumderSheikh Iqbal AhamedWilliam Cheng-Chung Chu","2013","http://link.springer.com/chapter/10.1007/978-3-642-39470-6_35","Chapter"
"Design and Evaluation of a Telepresence Robot for Interpersonal Communication with Older Adults","Inclusive Society: Health and Wellbeing in the Community, and Care at Home","","","","10.1007/978-3-642-39470-6_39","Yi-Shin ChenJun-Ming LuYeh-Liang Hsu","2013","http://link.springer.com/chapter/10.1007/978-3-642-39470-6_39","Chapter"
"An Orientation Service for Dependent People Based on an Open Service Architecture","HCI and Usability for Medicine and Health Care","","","","10.1007/978-3-540-76805-0_13","A. Fernández-MontesJ. A. ÁlvarezJ. A. OrtegaNatividad Martínez MadridRalf Seepold","2007","http://link.springer.com/chapter/10.1007/978-3-540-76805-0_13","Chapter"
"M-Learning for Elderlies: A Case Study","Distributed Computing and Artificial Intelligence","","","","10.1007/978-3-642-28765-7_77","Fernando de la PrietaAntonia MacarroAmparo JiménezAmparo CasadoKasper HallenborgJuan F. De PazSara RodríguezJavier Bajo","2012","http://link.springer.com/chapter/10.1007/978-3-642-28765-7_77","Chapter"
"GPRS Based Embedded Wireless Physiological Monitor for Telemedicine Applications","Advanced Research on Computer Science and Information Engineering","","","","10.1007/978-3-642-21411-0_81","Ying LiuXiao Min XuMamie Liu","2011","http://link.springer.com/chapter/10.1007/978-3-642-21411-0_81","Chapter"
"Attitudinal and Intentional Acceptance of Domestic Robots by Younger and Older Adults","Universal Access in Human-Computer Interaction. Intelligent and Ubiquitous Interaction Environments","","","","10.1007/978-3-642-02710-9_5","Neta EzerArthur D. FiskWendy A. Rogers","2009","http://link.springer.com/chapter/10.1007/978-3-642-02710-9_5","Chapter"
"Interactive Web-Phone Technology to Support and Optimize Care Plans for Aging and People with Disabilities","Aging Friendly Technology for Health and Independence","","","","10.1007/978-3-642-13778-5_17","Dick Schoech","2010","http://link.springer.com/chapter/10.1007/978-3-642-13778-5_17","Chapter"
"User Modeling and Adaptation for Daily Routines: Providing Assistance to People with Special and Specific Needs","Advances in User Modeling","","","","10.1007/978-3-642-28509-7_28","Estefanía MartínPablo HayaRosa M. Carro","2012","http://link.springer.com/chapter/10.1007/978-3-642-28509-7_28","Chapter"
