Item Title,Publication Title,Book Series Title,Journal Volume,Journal Issue,Item DOI,Authors,Publication Year,URL,Content Type
"A Contribution for Elderly and Disabled Care Using Intelligent Approaches","Distributed Computing, Artificial Intelligence, Bioinformatics, Soft Computing, and Ambient Assisted Living","","","","10.1007/978-3-642-02481-8_137","Gabriel Fiol-RoigMargaret Miró-Julià","2009","http://link.springer.com/chapter/10.1007/978-3-642-02481-8_137","Chapter"
"Different sADL Day Patterns Recorded by an Interaction-System Based on Radio Modules","Ambient Assisted Living","","","","10.1007/978-3-642-27491-6_7","Jakob NeuhaeuserMoritz WilkeningJanine Diehl-SchmidTim C. Lueth","2012","http://link.springer.com/chapter/10.1007/978-3-642-27491-6_7","Chapter"
"Ethical frontiers of ICT and older users: cultural, pragmatic and ethical issues","Ethics and Information Technology","","13","4","10.1007/s10676-011-9276-4","Athena McLean","2011","http://link.springer.com/article/10.1007/s10676-011-9276-4","Article"
"Hacking the Natural Habitat: An In-the-Wild Study of Smart Homes, Their Development, and the People Who Live in Them","Pervasive Computing","","","","10.1007/978-3-642-31205-2_10","Sarah MennickenElaine M. Huang","2012","http://link.springer.com/chapter/10.1007/978-3-642-31205-2_10","Chapter"
"Possible techniques and issues in fall detection using asynchronous temporal-contrast sensors","e & i Elektrotechnik und Informationstechnik","","127","7 - 8","10.1007/s00502-010-0751-0","Á. SrpF. Vajda","2010","http://link.springer.com/article/10.1007/s00502-010-0751-0","Article"
"Smart Integrated Systems: From Components to Products","More than Moore","","","","10.1007/978-0-387-75593-9_2","Thomas GessnerMario BaumWolfgang GessnerGünter Lugert","2009","http://link.springer.com/chapter/10.1007/978-0-387-75593-9_2","Chapter"
"Acceptance of Healthcare Robots for the Older Population: Review and Future Directions","International Journal of Social Robotics","","1","4","10.1007/s12369-009-0030-6","E. BroadbentR. StaffordB. MacDonald","2009","http://link.springer.com/article/10.1007/s12369-009-0030-6","Article"
"Innovative Health Services Using Cloud Computing and Internet of Things","Ubiquitous Computing and Ambient Intelligence","","","","10.1007/978-3-642-35377-2_58","Diego Gachet PáezFernando AparicioJuan R. AscanioAlberto Beaterio","2012","http://link.springer.com/chapter/10.1007/978-3-642-35377-2_58","Chapter"
"It’s All about the Medium: Identifying Patients’ Medial Preferences for Telemedical Consultations","Information Quality in e-Health","","","","10.1007/978-3-642-25364-5_23","Shirley BeulMartina ZiefleEva-Maria Jakobs","2011","http://link.springer.com/chapter/10.1007/978-3-642-25364-5_23","Chapter"
"YouTube and intergenerational communication: the case of Geriatric1927","Universal Access in the Information Society","","8","1","10.1007/s10209-008-0127-y","Dave HarleyGeraldine Fitzpatrick","2009","http://link.springer.com/article/10.1007/s10209-008-0127-y","Article"
"A High Road to Dutch Healthcare Reform","Handbook of Digital Homecare","","","","10.1007/8754_2011_19","A. C. M. DumaijR. MooijJ. L. T. Blank","2011","http://link.springer.com/chapter/10.1007/8754_2011_19","Chapter"
"Improving Context-Awareness in a Healthcare Multi-Agent System","Trends in Practical Applications of Agents and Multiagent Systems","","","","10.1007/978-3-642-19931-8_1","Ricardo S. AlonsoDante I. TapiaÓscar GarcíaDavid SanchoMiguel Sánchez","2011","http://link.springer.com/chapter/10.1007/978-3-642-19931-8_1","Chapter"
"Modular Hardware Design and Realization for Vital Signs Monitoring","Ambient Assisted Living and Home Care","","","","10.1007/978-3-642-35395-6_27","Jan HavlíkLenka LhotskáJakub ParákMatouš PokornýJan DvořakZdeněk Horčík","2012","http://link.springer.com/chapter/10.1007/978-3-642-35395-6_27","Chapter"
"Ambient Interfaces for Elderly People at Home","Ambient Intelligence in Everyday Life","","","","10.1007/11825890_13","Fausto J. Sainz SalcesMichael BaskettDavid Llewellyn-JonesDavid England","2006","http://link.springer.com/chapter/10.1007/11825890_13","Chapter"
"ICT Interface Design for Ageing People and People with Dementia","Supporting People with Dementia Using Pervasive Health Technologies","","","","10.1007/978-1-84882-551-2_11","Jonathan WallaceMaurice D. MulvennaSuzanne MartinSharon StephensWilliam Burns","2010","http://link.springer.com/chapter/10.1007/978-1-84882-551-2_11","Chapter"
"Smart is the New Green","New Mega Trends","","","","10.1057/9781137008091_2","Sarwant Singh","2012","http://link.springer.com/chapter/10.1057/9781137008091_2","Chapter"
"Hybrid gaming environments: keeping the human in the loop within the Internet of things","Universal Access in the Information Society","","11","3","10.1007/s10209-011-0242-z","Carsten Magerkurth","2012","http://link.springer.com/article/10.1007/s10209-011-0242-z","Article"
"Introduction to the ERCIM/EWICS Cyberphysical Systems Workshop 2012","Computer Safety, Reliability, and Security","","","","10.1007/978-3-642-33675-1_30","Erwin SchoitschAmund Skavhaug","2012","http://link.springer.com/chapter/10.1007/978-3-642-33675-1_30","Chapter"
"Functional Assessment Technologies","Eldercare Technology for Clinical Practitioners","","","","10.1007/978-1-59745-233-5_2","Marilyn Rantz R.N.Ph.D.F.A.A.N.Marjorie SkubicKathryn BurksJie YuGeorge DemirisBrian K. HenselGregory L. AlexanderZhihai HeHarry W. TyrerMarc HamiltonJia LeeMarybeth Brown","2008","http://link.springer.com/chapter/10.1007/978-1-59745-233-5_2","Chapter"
"Context Assessment during Blood Pressure Self-measurement Utilizing the Sensor Chair","Ambient Intelligence","","","","10.1007/978-3-642-25167-2_40","Stefan WagnerThomas Skjødeberg ToftegaardOlav Wedege Bertelsen","2011","http://link.springer.com/chapter/10.1007/978-3-642-25167-2_40","Chapter"
"A Regulatory Model for Context-Aware Abstract Framework","Trends in Applied Intelligent Systems","","","","10.1007/978-3-642-13022-9_40","Juanita PedrazaMiguel Á. PatricioAgustín De AsísJosé M. Molina","2010","http://link.springer.com/chapter/10.1007/978-3-642-13022-9_40","Chapter"
"Technology in Old Age from a Psychological Point of View","HCI and Usability for Medicine and Health Care","","","","10.1007/978-3-540-76805-0_11","Claudia OppenauerBarbara PreschlKarin KalteisIlse Kryspin-Exner","2007","http://link.springer.com/chapter/10.1007/978-3-540-76805-0_11","Chapter"
"An Analysis of Social Guarantees for Context Based Applications","Bio-Science and Bio-Technology","","","","10.1007/978-3-642-10616-3_12","Juanita PedrazaMiguel A. PatricioAgustin De AsísJose M. Molina","2009","http://link.springer.com/chapter/10.1007/978-3-642-10616-3_12","Chapter"
"WeCare: Wireless Enhanced Healthcare","XII Mediterranean Conference on Medical and Biological Engineering and Computing 2010","","","","10.1007/978-3-642-13039-7_216","Hande Ozgur AlemdarCem Ersoy","2010","http://link.springer.com/chapter/10.1007/978-3-642-13039-7_216","Chapter"
"Avatars in Assistive Homes for the Elderly","HCI and Usability for Education and Work","","","","10.1007/978-3-540-89350-9_27","Martin M. MorandellAndreas HochgattererSascha FagelSiegfried Wassertheurer","2008","http://link.springer.com/chapter/10.1007/978-3-540-89350-9_27","Chapter"
"User Behavior Shift Detection in Intelligent Environments","Ambient Assisted Living and Home Care","","","","10.1007/978-3-642-35395-6_12","Asier AztiriaGolnaz FarhadiHamid Aghajan","2012","http://link.springer.com/chapter/10.1007/978-3-642-35395-6_12","Chapter"
"A 3D shape retrieval framework for 3D smart cities","Frontiers of Computer Science in China","","4","3","10.1007/s11704-010-0366-y","Biao LengZhang XiongXiangwei Fu","2010","http://link.springer.com/article/10.1007/s11704-010-0366-y","Article"
"Studies to Determine User Requirements Regarding In-Home Monitoring Systems","User Modeling, Adaptation, and Personalization","","","","10.1007/978-3-642-31454-4_12","Melanie LarizzaIngrid ZukermanFabian BohnertR. Andrew RussellLucy BusijaDavid W. AlbrechtGwyn Rees","2012","http://link.springer.com/chapter/10.1007/978-3-642-31454-4_12","Chapter"
"Ambient Information Systems to Support the Elderly in Carrying Out Their Activities of Daily Living","On the Move to Meaningful Internet Systems: OTM 2009 Workshops","","","","10.1007/978-3-642-05290-3_94","Juan Pablo García-VázquezMarcela D. Rodríguez","2009","http://link.springer.com/chapter/10.1007/978-3-642-05290-3_94","Chapter"
"Augmented Photoframe for Interactive Smart Space","Aging Friendly Technology for Health and Independence","","","","10.1007/978-3-642-13778-5_8","Koen De VoegtMohamed Ali FekiLaurence ClaeysJohan CrielPascal ZontropMarc GodonMarc RoelandsMarjan GeertsLieven Trappeniers","2010","http://link.springer.com/chapter/10.1007/978-3-642-13778-5_8","Chapter"
"Technical Expertise and Its Influence on the Acceptance of Future Medical Technologies: What Is Influencing What to Which Extent?","HCI in Work and Learning, Life and Leisure","","","","10.1007/978-3-642-16607-5_40","Martina ZiefleAnne Kathrin Schaar","2010","http://link.springer.com/chapter/10.1007/978-3-642-16607-5_40","Chapter"
"Handling User Interface Plasticity in Assistive Environment: UbiSMART Framework","Toward Useful Services for Elderly and People with Disabilities","","","","10.1007/978-3-642-21535-3_37","Thibaut TiberghienMounir MokhtariHamdi AloulouJit BiswasJiaqi ZhuVwen Yen Lee","2011","http://link.springer.com/chapter/10.1007/978-3-642-21535-3_37","Chapter"
"Living Labs as Educational Tool for Ambient Intelligence","Ambient Intelligence","","","","10.1007/978-3-642-34898-3_27","Ben KröseMettina VeenstraSaskia RobbenMarije Kanis","2012","http://link.springer.com/chapter/10.1007/978-3-642-34898-3_27","Chapter"
"Managing Ambient Intelligence Sensor Network Systems, an Agent Based Approach","Bio-Inspired Systems: Computational and Ambient Intelligence","","","","10.1007/978-3-642-02478-8_140","Guillermo BoschCristian Barrué","2009","http://link.springer.com/chapter/10.1007/978-3-642-02478-8_140","Chapter"
"Accounting for User Diversity in the Acceptance of Medical Assistive Technologies","Electronic Healthcare","","","","10.1007/978-3-642-23635-8_22","Sylvia KowalewskiWiktoria WilkowskaMartina Ziefle","2012","http://link.springer.com/chapter/10.1007/978-3-642-23635-8_22","Chapter"
"Developing technology to support the functional independence of older adults","Ageing International","","27","1","10.1007/s12126-001-1014-5","Elizabeth D. MynattWendy A. Rogers","2001","http://link.springer.com/article/10.1007/s12126-001-1014-5","Article"
"Ambient intelligence for ubiquitous health and wellbeing","annals of telecommunications - annales des télécommunications","","65","9 - 10","10.1007/s12243-010-0192-0","Mounir MokhtariMohamed Ali FekiChris D. Nugent","2010","http://link.springer.com/article/10.1007/s12243-010-0192-0","Article"
"Design and Integration of Fall and Mobility Monitors in Health Monitoring Platforms","Wearable and Autonomous Biomedical Devices and Systems for Smart Environment","","","","10.1007/978-3-642-15687-8_1","Pepijn van de VenAlan BourkeJohn NelsonHugh O’Brien","2010","http://link.springer.com/chapter/10.1007/978-3-642-15687-8_1","Chapter"
"An Ontology-Based Actuator Discovery and Invocation Framework in Home Care Systems","Ambient Assistive Health and Wellness Management in the Heart of the City","","","","10.1007/978-3-642-02868-7_9","Feng WangKenneth J. Turner","2009","http://link.springer.com/chapter/10.1007/978-3-642-02868-7_9","Chapter"
"Smart Cities, Healthy Kids: The Association Between Neighbourhood Design and Children’s Physical Activity and Time Spent Sedentary","Canadian Journal of Public Health","","103","3","10.1007/BF03403831","Dale W. Esliger PhDLauren B. Sherar PhDNazeem Muhajarine PhD","2012","http://link.springer.com/article/10.1007/BF03403831","Article"
"An Orientation Service for Dependent People Based on an Open Service Architecture","HCI and Usability for Medicine and Health Care","","","","10.1007/978-3-540-76805-0_13","A. Fernández-MontesJ. A. ÁlvarezJ. A. OrtegaNatividad Martínez MadridRalf Seepold","2007","http://link.springer.com/chapter/10.1007/978-3-540-76805-0_13","Chapter"
"Context-Awareness Enabling New Business Models in Smart Spaces","Smart Spaces and Next Generation Wired/Wireless Networking","","","","10.1007/978-3-642-14891-0_2","Boris MoltchanovChristian MannweilerJose Simoes","2010","http://link.springer.com/chapter/10.1007/978-3-642-14891-0_2","Chapter"
"DIAMI: Distributed Intelligent Environment for Blind Musicians","Distributed Computing, Artificial Intelligence, Bioinformatics, Soft Computing, and Ambient Assisted Living","","","","10.1007/978-3-642-02481-8_68","José E. DíazJuan L. MárquezMiguel SánchezJosé M. Sánchez-AguileraMiguel A. SánchezJavier Bajo","2009","http://link.springer.com/chapter/10.1007/978-3-642-02481-8_68","Chapter"
"A design process enabling adaptation in pervasive heterogeneous contexts","Personal and Ubiquitous Computing","","15","4","10.1007/s00779-010-0356-y","Jean-Baptiste LézorayMaria-Teresa SegarraAn Phung-KhacAndré ThépautJean-Marie GilliotAntoine Beugnard","2011","http://link.springer.com/article/10.1007/s00779-010-0356-y","Article"
"Multiple People Activity Recognition Using MHT over DBN","Toward Useful Services for Elderly and People with Disabilities","","","","10.1007/978-3-642-21535-3_48","Andrei TolstikovClifton PhuaJit BiswasWeimin Huang","2011","http://link.springer.com/chapter/10.1007/978-3-642-21535-3_48","Chapter"
"Unobtrusive Sleep Posture Detection for Elder-Care in Smart Home","Aging Friendly Technology for Health and Independence","","","","10.1007/978-3-642-13778-5_9","Hongbo NiBessam AbdulrazakDaqing ZhangShu Wu","2010","http://link.springer.com/chapter/10.1007/978-3-642-13778-5_9","Chapter"
"A Novel Smart Home System","Instrumentation, Measurement, Circuits and Systems","","","","10.1007/978-3-642-27334-6_101","Ligeng YuXueen LiWeijuan Han","2012","http://link.springer.com/chapter/10.1007/978-3-642-27334-6_101","Chapter"
"A Home E-Health System for Dependent People Based on OSGI","Intelligent Technical Systems","","","","10.1007/978-1-4020-9823-9_9","Jaime MartínRalf SeepoldNatividad Martínez MadridJuan Antonio ÁlvarezAlejandro Fernández-MontesJuan Antonio Ortega","2009","http://link.springer.com/chapter/10.1007/978-1-4020-9823-9_9","Chapter"
"Modeling Actions Based on a Situative Space Model for Recognizing Human Activities","Artificial Intelligence: Methodology, Systems, and Applications","","","","10.1007/978-3-642-33185-5_30","Juan Carlos NievesDipak SurieHelena Lindgren","2012","http://link.springer.com/chapter/10.1007/978-3-642-33185-5_30","Chapter"
"Granny and the robots: ethical issues in robot care for the elderly","Ethics and Information Technology","","14","1","10.1007/s10676-010-9234-6","Amanda SharkeyNoel Sharkey","2012","http://link.springer.com/article/10.1007/s10676-010-9234-6","Article"
"Cyber-Physical Systems: Imminent Challenges","Large-Scale Complex IT Systems. Development, Operation and Management","","","","10.1007/978-3-642-34059-8_1","Manfred BroyMaría Victoria CengarleEva Geisberger","2012","http://link.springer.com/chapter/10.1007/978-3-642-34059-8_1","Chapter"
"Healthcare Prosumerism","Future Visions on Biomedicine and Bioinformatics 1","","","","10.1007/8754_2010_3","A. C. M. DumayJ. L. T. Blank","2011","http://link.springer.com/chapter/10.1007/8754_2010_3","Chapter"
"Collaborative Ecosystems in Ageing Support","Adaptation and Value Creating Collaborative Networks","","","","10.1007/978-3-642-23330-2_20","Luis M. Camarinha-MatosHamideh Afsarmanesh","2011","http://link.springer.com/chapter/10.1007/978-3-642-23330-2_20","Chapter"
"A Framework for Engineering Pervasive Applications Applied to Intra-vehicular Sensor Network Applications","Mobile Networks and Applications","","15","1","10.1007/s11036-009-0163-8","Antonio CoronatoGiuseppe De PietroJong-Hyuk ParkHan-Chieh Chao","2010","http://link.springer.com/article/10.1007/s11036-009-0163-8","Article"
"Past, Present and Future of Ambient Intelligence and Smart Environments","Agents and Artificial Intelligence","","","","10.1007/978-3-642-11819-7_1","Juan Carlos Augusto","2010","http://link.springer.com/chapter/10.1007/978-3-642-11819-7_1","Chapter"
"Hallway Monitoring: Distributed Data Processing with Wireless Sensor Networks","Real-World Wireless Sensor Networks","","","","10.1007/978-3-642-17520-6_9","Tobias BaumgartnerSándor P. FeketeTom KamphansAlexander KröllerMax Pagel","2010","http://link.springer.com/chapter/10.1007/978-3-642-17520-6_9","Chapter"
"Effects of Multimodal Feedback on the Usability of Mobile Diet Diary for Older Adults","Universal Access in Human-Computer Interaction. Applications and Services","","","","10.1007/978-3-642-02713-0_31","Miroslav BojicOlivier A. Blanson HenkemansMark A. NeerincxCharles A. P. G. Van der MastJasper Lindenberg","2009","http://link.springer.com/chapter/10.1007/978-3-642-02713-0_31","Chapter"
"Semantic and Implicit HCI: A Step Forward AmI Delivery at Home for Patient Experience","Ambient Intelligence and Future Trends-International Symposium on Ambient Intelligence (ISAmI 2010)","","","","10.1007/978-3-642-13268-1_17","Ana Isabel Calvo-AlcaldeJuan José Andrés-GutiérrezJesús VegasRafael Cano-ParraEsteban Pérez-Castrejón","2010","http://link.springer.com/chapter/10.1007/978-3-642-13268-1_17","Chapter"
"Context-based scene recognition from visual data in smart homes: an Information Fusion approach","Personal and Ubiquitous Computing","","16","7","10.1007/s00779-011-0450-9","Juan Gómez-RomeroMiguel A. SerranoMiguel A. PatricioJesús GarcíaJosé M. Molina","2012","http://link.springer.com/article/10.1007/s00779-011-0450-9","Article"
"A Telehealthcare System to Care for Older People Suffering from Metabolic Syndrome","Universal Access in Human-Computer Interaction. Users Diversity","","","","10.1007/978-3-642-21663-3_25","Kevin C. TsengChien-Lung HsuYu-Hao Chuang","2011","http://link.springer.com/chapter/10.1007/978-3-642-21663-3_25","Chapter"
"Location-Aware Elderly Personal Safety Checking in Smart Home","Computer, Informatics, Cybernetics and Applications","","","","10.1007/978-94-007-1839-5_170","Bin XuZepeng HuPeiyou HanYujia Ge","2012","http://link.springer.com/chapter/10.1007/978-94-007-1839-5_170","Chapter"
"Autonomamente: Using Goal Attainment Scales to Evaluate the Impact of a Multimodal Domotic System to Support Autonomous Life of People with Cognitive Impairment","Computers Helping People with Special Needs","","","","10.1007/978-3-642-14097-6_52","Thimoty BarbieriPiero FraternaliAntonio BianchiClarissa Tacchella","2010","http://link.springer.com/chapter/10.1007/978-3-642-14097-6_52","Chapter"
"The evolution of home modification programs in Japan","Ageing International","","27","3","10.1007/s12126-003-1004-x","Kuniko Makigami M.D., M.S.G.Jon Pynoos Ph.D.","2002","http://link.springer.com/article/10.1007/s12126-003-1004-x","Article"
"Artificial Neural Networks in Smart Homes","Designing Smart Homes","","","","10.1007/11788485_9","Rezaul BeggRafiul Hassan","2006","http://link.springer.com/chapter/10.1007/11788485_9","Chapter"
"Proposed Generic Method to Assess Efficiency of Smart-Walkers","Impact Analysis of Solutions for Chronic Disease Prevention and Management","","","","10.1007/978-3-642-30779-9_29","Viviane PasquiLudovic Saint-BauzelPierre RumeauNadine Vigouroux","2012","http://link.springer.com/chapter/10.1007/978-3-642-30779-9_29","Chapter"
"Human Centered Interfaces for Assisted Living","Man-Machine Interactions 2","","","","10.1007/978-3-642-23169-8_1","Anastasios TefasIoannis Pitas","2011","http://link.springer.com/chapter/10.1007/978-3-642-23169-8_1","Chapter"
"Universal Access Issues in an Ambient Intelligence Research Facility","Universal Access in Human-Computer Interaction. Ambient Interaction","","","","10.1007/978-3-540-73281-5_22","Constantine StephanidisMargherita AntonaDimitrios Grammenos","2007","http://link.springer.com/chapter/10.1007/978-3-540-73281-5_22","Chapter"
"A Novel Design Approach for Multi-device Adaptable User Interfaces: Concepts, Methods and Examples","Universal Access in Human-Computer Interaction. Design for All and eInclusion","","","","10.1007/978-3-642-21672-5_44","Alexandros MourouzisAsterios LeonidisMichalis FoukarakisMargherita AntonaNicos Maglaveras","2011","http://link.springer.com/chapter/10.1007/978-3-642-21672-5_44","Chapter"
"Openness to Accept Medical Technology - A Cultural View","Information Quality in e-Health","","","","10.1007/978-3-642-25364-5_14","Firat AlagözMartina ZiefleWiktoria WilkowskaAndré Calero Valdez","2011","http://link.springer.com/chapter/10.1007/978-3-642-25364-5_14","Chapter"
"Plans and Planning in Smart Homes","Designing Smart Homes","","","","10.1007/11788485_5","Richard SimpsonDebra SchreckenghostEdmund F. LoPrestiNed Kirsch","2006","http://link.springer.com/chapter/10.1007/11788485_5","Chapter"
"The Enigma of Japanese Ageing-in-Place Practice in the Information Age: Does Digital Gadget Help the (Good) Practice for Inter-Generation Care?","Ageing International","","32","3","10.1007/s12126-008-9017-0","On-Kwok Lai","2008","http://link.springer.com/article/10.1007/s12126-008-9017-0","Article"
"Gerontechnology","Future Interaction Design II","","","","10.1007/978-1-84800-385-9_1","Neil CharnessTiffany S. Jastrzembski","2009","http://link.springer.com/chapter/10.1007/978-1-84800-385-9_1","Chapter"
"Complexity aided design","The European Physical Journal Special Topics","","214","1","10.1140/epjst/e2012-01701-5","A. CarboneM. Ajmone-MarsanK. W. AxhausenM. BattyM. MaseraE. Rome","2012","http://link.springer.com/article/10.1140/epjst/e2012-01701-5","Article"
"Using Future Internet Infrastructure and Smartphones for Mobility Trace Acquisition and Social Interactions Monitoring","The Future Internet","","","","10.1007/978-3-642-30241-1_11","Athanasios AntoniouEvangelos TheodoridisIoannis ChatzigiannakisGeorgios Mylonas","2012","http://link.springer.com/chapter/10.1007/978-3-642-30241-1_11","Chapter"
"Toward Integrated Real-World Sensing Environment — Applications and Challenges","Theoretical Aspects of Distributed Computing in Sensor Networks","","","","10.1007/978-3-642-14849-1_27","Srdjan KrcoKonrad Wrona","2011","http://link.springer.com/chapter/10.1007/978-3-642-14849-1_27","Chapter"
"Smart Home Technology for the Elderly: Perceptions of Multidisciplinary Stakeholders","Constructing Ambient Intelligence","","","","10.1007/978-3-540-85379-4_37","Anne-mie SponseleeBen SchoutenDon BouwhuisCharles Willems","2008","http://link.springer.com/chapter/10.1007/978-3-540-85379-4_37","Chapter"
"Cyber-Physical Systems — Changing Economy and Society","Cyber-Physical Systems","","","","10.1007/978-3-642-29090-9_3","","2011","http://link.springer.com/chapter/10.1007/978-3-642-29090-9_3","Chapter"
"Editorial to first issue","Journal of Ambient Intelligence and Humanized Computing","","1","1","10.1007/s12652-010-0009-z","Vincenzo Loia","2010","http://link.springer.com/article/10.1007/s12652-010-0009-z","Article"
"WebService-Based Solution for an Intelligent TeleCare System","Recent Advances in Intelligent Engineering Systems","","","","10.1007/978-3-642-23229-9_18","Vasile Stoicu-TivadarLăcrămioara Stoicu-TivadarSorin PuşcociDorin BerianVasile Topac","2012","http://link.springer.com/chapter/10.1007/978-3-642-23229-9_18","Chapter"
"Telemedicine: New Approach to Modern Education of Medical Electronics","5th European Conference of the International Federation for Medical and Biological Engineering","","","","10.1007/978-3-642-23508-5_358","J. HavlikJ. DvorakL. Lhotska","2012","http://link.springer.com/chapter/10.1007/978-3-642-23508-5_358","Chapter"
"User Acceptance of the Intelligent Fridge: Empirical Results from a Simulation","The Internet of Things","","","","10.1007/978-3-540-78731-0_8","Matthias Rothensee","2008","http://link.springer.com/chapter/10.1007/978-3-540-78731-0_8","Chapter"
"Smart Silver Towns: Prospects and Challenges","Toward Useful Services for Elderly and People with Disabilities","","","","10.1007/978-3-642-21535-3_17","Sung Jun KimBharat Dave","2011","http://link.springer.com/chapter/10.1007/978-3-642-21535-3_17","Chapter"
"Sense of Presence in a Robotic Telepresence Domain","Universal Access in Human-Computer Interaction. Users Diversity","","","","10.1007/978-3-642-21663-3_51","Annica KristofferssonSilvia CoradeschiKerstin Severinson EklundhAmy Loutfi","2011","http://link.springer.com/chapter/10.1007/978-3-642-21663-3_51","Chapter"
"Ensuring a Fruitful Future to Innovation and Research: Practical Guidance for the Involvement of Older People in Research","Impact Analysis of Solutions for Chronic Disease Prevention and Management","","","","10.1007/978-3-642-30779-9_4","Anne-Sophie ParentNena GeorgantziIlenia Gheno","2012","http://link.springer.com/chapter/10.1007/978-3-642-30779-9_4","Chapter"
"Cases, Context, and Comfort: Opportunities for Case-Based Reasoning in Smart Homes","Designing Smart Homes","","","","10.1007/11788485_7","David LeakeAna MaguitmanThomas Reichherzer","2006","http://link.springer.com/chapter/10.1007/11788485_7","Chapter"
"Safety Considerations in the Development of Intelligent Environments","Ambient Intelligence - Software and Applications","","","","10.1007/978-3-642-19937-0_25","Juan Carlos AugustoPaul J. McCullagh","2011","http://link.springer.com/chapter/10.1007/978-3-642-19937-0_25","Chapter"
"ALADIN - a Magic Lamp for the Elderly?","Handbook of Ambient Intelligence and Smart Environments","","","","10.1007/978-0-387-93808-0_44","Edith MaierGuido Kempter","2010","http://link.springer.com/chapter/10.1007/978-0-387-93808-0_44","Chapter"
